,ID,Title,Type,Venue Name,Venue ID,Venue ISBN,Venue Acronym,Venue Presented At,Venue Extra,Venue Map Name,Venue Map ID,Citations,Collaborations,Experiments,Classification,Year,Citations 1991,Citations 1992,Citations 1993,Citations 1994,Citations 1995,Citations 1996,Citations 1997,Citations 1998,Citations 1999,Citations 2000,Citations 2001,Citations 2002,Citations 2003,Citations 2004,Citations 2005,Citations 2006,Citations 2007,Citations 2008,Citations 2009,Citations 2010,Citations 2011,Citations 2012,Citations 2013,Citations 2014,Citations 2015,Citations 2016,Citations 2017,Citations 2018,Citations 2019,Citations 2020
349,1421134,GW150914: First results from the search for binary black hole coalescence with Advanced LIGO,published;hep;core;citeable;arxiv,Phys.Rev.,,,,,,PHYSICAL REVIEW D,14759,288,LIGO Scientific;Virgo,LIGO;VIRGO,gr-qc;Gravitation and Cosmology;astro-ph.HE;Astrophysics;astro-ph.IM;Instrumentation,2016,0,0,0,0,0,0,0,0,0,0,0,0,0,0,0,0,0,0,0,0,0,0,0,0,0,49,77,54,42,59
350,1421135,Properties of the Binary Black Hole Merger GW150914,published;hep;core;citeable;arxiv,Phys.Rev.Lett.,,,,,,PHYSICAL REVIEW LETTERS,14761,603,LIGO Scientific;Virgo,LIGO;VIRGO,gr-qc;Gravitation and Cosmology;astro-ph.HE;Astrophysics,2016,0,0,0,0,0,0,0,0,0,0,0,0,0,0,0,0,0,0,0,0,0,0,0,0,0,108,135,119,110,126
351,1421136,The Rate of Binary Black Hole Mergers Inferred from Advanced LIGO Observations Surrounding GW150914,published;hep;core;citeable;arxiv,Astrophys.J.Lett.,,,,,,ASTROPHYSICAL JOURNAL LETTERS,2101,314,LIGO Scientific;Virgo,LIGO;VIRGO,astro-ph.HE;Astrophysics;gr-qc;Gravitation and Cosmology,2016,0,0,0,0,0,0,0,0,0,0,0,0,0,0,0,0,0,0,0,0,0,0,0,0,1,69,84,61,53,44
352,1421137,Observing gravitational-wave transient GW150914 with minimal assumptions,published;hep;core;citeable;arxiv,Phys.Rev.,,,,,,PHYSICAL REVIEW D,14759,170,LIGO Scientific;Virgo,LIGO;VIRGO,gr-qc;Gravitation and Cosmology;astro-ph.HE;Astrophysics;astro-ph.IM;Instrumentation,2016,0,0,0,0,0,0,0,0,0,0,0,0,0,0,0,0,0,0,0,0,0,0,0,0,0,28,41,22,36,38
353,1421138,Characterization of transient noise in Advanced LIGO relevant to gravitational wave signal GW150914,published;hep;core;citeable;arxiv,Class.Quant.Grav.,,,,,,CLASSICAL AND QUANTUM GRAVITY,3723,202,LIGO Scientific;Virgo,LIGO;VIRGO,gr-qc;Gravitation and Cosmology;astro-ph.HE;Astrophysics;astro-ph.IM;Instrumentation;physics.ins-det,2016,0,0,0,0,0,0,0,0,0,0,0,0,0,0,0,0,0,0,0,0,0,0,0,0,0,18,44,42,36,60
354,1421139,Calibration of the Advanced LIGO detectors for the discovery of the binary black-hole merger GW150914,published;hep;core;citeable;arxiv,Phys.Rev.,,,,,,PHYSICAL REVIEW D,14759,102,LIGO Scientific,LIGO,gr-qc;Gravitation and Cosmology;astro-ph.IM;Instrumentation;physics.ins-det,2017,0,0,0,0,0,0,0,0,0,0,0,0,0,0,0,0,0,0,0,0,0,0,0,0,0,20,29,22,15,16
355,1421140,Astrophysical Implications of the Binary Black-Hole Merger GW150914,published;hep;core;citeable;arxiv,Astrophys.J.Lett.,,,,,"ApJL, 818, L22, 2016",ASTROPHYSICAL JOURNAL LETTERS,2101,498,LIGO Scientific;Virgo,VIRGO;LIGO,astro-ph.HE;Astrophysics;gr-qc;Gravitation and Cosmology,2016,0,0,0,0,0,0,0,0,0,0,0,0,0,0,0,0,0,0,0,0,0,0,0,0,2,84,116,106,97,84
356,1421141,GW150914: Implications for the stochastic gravitational wave background from binary black holes,published;hep;core;citeable;arxiv,Phys.Rev.Lett.,,,,,,PHYSICAL REVIEW LETTERS,14761,247,LIGO Scientific;Virgo,LIGO;VIRGO,gr-qc;Gravitation and Cosmology;astro-ph.HE;Astrophysics,2016,0,0,0,0,0,0,0,0,0,0,0,0,0,0,0,0,0,0,0,0,0,0,0,0,0,46,60,52,43,41
357,1421154,Tests of general relativity with GW150914,published;hep;core;citeable;arxiv,Phys.Rev.Lett.,,,,,,PHYSICAL REVIEW LETTERS,14761,1119,LIGO Scientific;Virgo,LIGO;VIRGO,gr-qc;Gravitation and Cosmology,2016,0,0,0,0,0,0,0,0,0,0,0,0,0,0,0,0,0,0,0,0,0,0,0,0,0,114,185,198,248,359
358,1421618,Electromagnetic Counterparts to Black Hole Mergers Detected by LIGO,published;hep;core;citeable;arxiv,Astrophys.J.Lett.,,,,,,ASTROPHYSICAL JOURNAL LETTERS,2101,183,,LIGO,astro-ph.HE;Astrophysics;astro-ph.CO;astro-ph.SR;gr-qc;Gravitation and Cosmology,2016,0,0,0,0,0,0,0,0,0,0,0,0,0,0,0,0,0,0,0,0,0,0,0,0,0,37,53,35,34,21
359,1422032,High-energy Neutrino follow-up search of Gravitational Wave Event GW150914 with ANTARES and IceCube,published;hep;core;citeable;arxiv,Phys.Rev.,,,,,,PHYSICAL REVIEW D,14759,143,ANTARES;IceCube;LIGO Scientific;Virgo,ANTARES;ICECUBE;LIGO;VIRGO,astro-ph.HE;Astrophysics,2016,0,0,0,0,0,0,0,0,0,0,0,0,0,0,0,0,0,0,0,0,0,0,0,0,0,24,44,21,22,21
360,1424769,Localization and broadband follow-up of the gravitational-wave transient GW150914,published;hep;core;fermilab;citeable;arxiv,Astrophys.J.Lett.,,,,,,ASTROPHYSICAL JOURNAL LETTERS,2101,221,LIGO Scientific;Virgo;ASKAP;BOOTES;DES;Fermi GBM;Fermi-LAT;GRAWITA;INTEGRAL;iPTF;InterPlanetary Network;J-GEM;La Silla-QUEST Survey;Liverpool Telescope;LOFAR;MASTER;MAXI;MWA;Pan-STARRS;PESSTO;Pi of the Sky;SkyMapper;Swift;C2PU;TOROS;VISTA,LIGO;VIRGO;FERMI-LAT;DES;INTEGRAL;LOFAR;MWA;PAN-STARRS;SWIFT,astro-ph.HE;Astrophysics;gr-qc;Gravitation and Cosmology,2016,0,0,0,0,0,0,0,0,0,0,0,0,0,0,0,0,0,0,0,0,0,0,0,0,1,47,87,42,25,14
361,1441153,Sensitivity of the Advanced LIGO detectors at the beginning of gravitational wave astronomy,published;hep;core;citeable;arxiv,Phys.Rev.,,,,,,PHYSICAL REVIEW D,14759,227,,LIGO,astro-ph.IM;Instrumentation;physics.ins-det,2016,0,0,0,0,0,0,0,0,0,0,0,0,0,0,0,0,0,0,0,0,0,0,0,0,0,15,37,42,53,78
362,1452652,Supplement: Localization and broadband follow-up of the gravitational-wave transient GW150914,published;hep;core;fermilab;citeable;arxiv,Astrophys.J.Suppl.,,,,,,,,43,LIGO Scientific;Virgo;ASKAP;BOOTES;DES;Fermi-GBM;Fermi-LAT;GRAWITA;INTEGRAL;iPTF;InterPlanetary Network;J-GEM;La Silla-QUEST Survey;Liverpool Telescope;LOFAR;MASTER;MAXI;MWA;Pan-STARRS;PESSTO;Pi of the Sky;SkyMapper;Swift;TAROT;Zadko;Algerian National Observatory;C2PU;TOROS;VISTA,LIGO;VIRGO;FERMI-LAT;DES;INTEGRAL;LOFAR;MWA;PAN-STARRS;SWIFT,astro-ph.HE;Astrophysics;gr-qc;Gravitation and Cosmology,2016,0,0,0,0,0,0,0,0,0,0,0,0,0,0,0,0,0,0,0,0,0,0,0,0,0,6,17,10,3,5
363,1452858,Optimized multilayer dielectric mirror coatings for gravitational wave interferometers,hep;core;conferencepaper;citeable,Proc.SPIE Int.Soc.Opt.Eng.,,,,,,,,12,,LIGO,Instrumentation,2006,0,0,0,0,0,0,0,0,0,0,0,0,0,0,0,0,0,0,0,4,1,0,0,0,0,2,0,0,1,2
364,1455866,Search for transient gravitational waves in coincidence with short-duration radio transients during 20072013,published;hep;core;citeable;arxiv,Phys.Rev.,,,,,"Phys. Rev. D 93, 122008 (2016)",PHYSICAL REVIEW D,14759,15,LIGO Scientific;Virgo,LIGO;VIRGO,astro-ph.HE;Astrophysics,2016,0,0,0,0,0,0,0,0,0,0,0,0,0,0,0,0,0,0,0,0,0,0,0,0,0,0,1,5,2,7
365,1456116,A First Targeted Search for Gravitational-Wave Bursts from Core-Collapse Supernovae in Data of First-Generation Laser Interferometer Detectors,published;hep;core;citeable;arxiv,Phys.Rev.,,,,,,PHYSICAL REVIEW D,14759,50,LIGO Scientific;Virgo,LIGO;VIRGO,gr-qc;Gravitation and Cosmology;astro-ph.HE;Astrophysics,2016,0,0,0,0,0,0,0,0,0,0,0,0,0,0,0,0,0,0,0,0,0,0,0,0,0,3,7,10,10,19
366,1457569,Comprehensive all-sky search for periodic gravitational waves in the sixth science run LIGO data,published;hep;core;citeable;arxiv,Phys.Rev.,,,,,,PHYSICAL REVIEW D,14759,31,LIGO Scientific;Virgo,LIGO;VIRGO,gr-qc;Gravitation and Cosmology;astro-ph.IM;Instrumentation,2016,0,0,0,0,0,0,0,0,0,0,0,0,0,0,0,0,0,0,0,0,0,0,0,0,0,3,11,12,3,2
367,1458938,Supplement: Going the Distance: Mapping Host Galaxies of LIGO and Virgo Sources in Three Dimensions Using Local Cosmography and Targeted Follow-up,hep;citeable;published;arxiv,Astrophys.J.Suppl.,,,,,,,,27,,LIGO;VIRGO,astro-ph.IM;Instrumentation;astro-ph.HE;Astrophysics,2016,0,0,0,0,0,0,0,0,0,0,0,0,0,0,0,0,0,0,0,0,0,0,0,0,0,2,2,3,6,13
368,1466479,Gravitational-wave sky and recent results from ground based detectors,hep;core;conferencepaper;citeable,NA,1452627,,,,,NA,NA,,LIGO Scientific;Virgo,VIRGO;LIGO,Gravitation and Cosmology;Experiment-HEP,2013,0,0,0,0,0,0,0,0,0,0,0,0,0,0,0,0,0,0,0,0,0,0,0,0,0,0,0,0,0,0
369,1467204,Improved analysis of GW150914 using a fully spin-precessing waveform Model,hep;citeable;published;arxiv,Phys.Rev.,,,,,,PHYSICAL REVIEW D,14759,116,LIGO Scientific;Virgo,VIRGO;LIGO,gr-qc;Gravitation and Cosmology;astro-ph.HE;Astrophysics,2016,0,0,0,0,0,0,0,0,0,0,0,0,0,0,0,0,0,0,0,0,0,0,0,0,0,13,39,23,22,18
370,1467402,Directly comparing GW150914 with numerical solutions of Einsteins equations for binary black hole coalescence,published;hep;core;citeable;arxiv,Phys.Rev.,,,,,,PHYSICAL REVIEW D,14759,97,LIGO Scientific;Virgo,LIGO;VIRGO,gr-qc;Gravitation and Cosmology;astro-ph.CO;Astrophysics;astro-ph.HE,2016,0,0,0,0,0,0,0,0,0,1,0,0,0,0,0,0,0,0,0,0,0,0,0,0,0,4,34,14,20,23
371,1469040,Supplement: The Rate of Binary Black Hole Mergers Inferred from Advanced LIGO Observations Surrounding GW150914,published;hep;core;citeable;arxiv,Astrophys.J.Suppl.,,,,,"ApJS, 227, 14, 2016",,,59,LIGO Scientific;Virgo,LIGO;VIRGO,astro-ph.HE;Astrophysics;astro-ph.IM;Instrumentation,2016,0,0,0,0,0,0,0,0,0,0,0,0,0,0,0,0,0,0,0,0,0,0,0,0,0,3,13,16,12,15
372,1469395,GW151226: Observation of Gravitational Waves from a 22-Solar-Mass Binary Black Hole Coalescence,published;hep;core;citeable;arxiv,Phys.Rev.Lett.,,,,,,PHYSICAL REVIEW LETTERS,14761,2493,LIGO Scientific;Virgo,LIGO;VIRGO,Gravitation and Cosmology,2016,0,0,0,0,0,0,0,0,0,0,0,0,0,0,0,0,0,0,0,1,0,0,0,0,2,160,610,700,543,445
373,1469423,Binary Black Hole Mergers in the first Advanced LIGO Observing Run,hep;core;citeable;published,Phys.Rev.,,,,,"Phys. Rev. X 6, 041015 (2016)",PHYSICAL REVIEW D,14759,1183,LIGO Scientific;Virgo,LIGO;VIRGO,Gravitation and Cosmology;Astrophysics;gr-qc;astro-ph.CO,2016,0,0,0,0,0,0,0,0,0,0,0,0,0,0,0,0,0,0,0,0,0,0,0,0,1,48,283,267,259,315
374,1473005,Small optic suspensions for Advanced LIGO input optics and other precision optical experiments,published;hep;core;citeable;arxiv,Rev.Sci.Instrum.,,,,,,REVIEW OF SCIENTIFIC INSTRUMENTS,16701,,,LIGO,physics.ins-det;Instrumentation,2016,0,0,0,0,0,0,0,0,0,0,0,0,0,0,0,0,0,0,0,0,0,0,0,0,0,0,0,0,0,0
375,1473037,Results of the deepest all-sky survey for continuous gravitational waves on LIGO S6 data running on the Einstein@Home volunteer distributed computing project,published;hep;core;citeable;arxiv,Phys.Rev.,,,,,,PHYSICAL REVIEW D,14759,36,LIGO Scientific;Virgo,LIGO;VIRGO,gr-qc;Gravitation and Cosmology;astro-ph.IM;Instrumentation,2016,0,0,0,0,0,0,0,0,0,0,0,0,0,0,0,0,0,0,0,0,0,0,0,0,0,2,14,10,6,4
376,1474226,Locking the Advanced LIGO Gravitational Wave Detector: with a focus on the Arm Length Stabilization Technique,hep;thesis;core,NA,,,,,,NA,NA,1,,LIGO,Gravitation and Cosmology,2015,0,0,0,0,0,0,0,0,0,0,0,0,0,0,0,0,0,0,0,0,0,0,0,0,0,0,0,0,0,1
377,1474639,A Study on the Characterization and Implementation of Tools for Advanced LIGO,hep;thesis;core,NA,,,,,,NA,NA,,,LIGO,Gravitation and Cosmology,2016,0,0,0,0,0,0,0,0,0,0,0,0,0,0,0,0,0,0,0,0,0,0,0,0,0,0,0,0,0,0
378,1474656,Search for continuous gravitational waves from neutron stars in globular cluster NGC 6544,published;hep;core;citeable;arxiv,Phys.Rev.,,,,,,PHYSICAL REVIEW D,14759,16,LIGO Scientific;VIRGO,LIGO;VIRGO,gr-qc;Gravitation and Cosmology;astro-ph.HE;Astrophysics,2017,0,0,0,0,0,0,0,0,0,0,0,0,0,0,0,0,0,0,0,0,0,0,0,0,0,0,6,5,2,3
379,1478010,Upper Limits on the Rates of Binary Neutron Star and Neutron Starblack Hole Mergers From Advanced Ligos First Observing run,published;hep;core;citeable;arxiv,Astrophys.J.Lett.,,,,,,ASTROPHYSICAL JOURNAL LETTERS,2101,161,LIGO Scientific;Virgo,LIGO;VIRGO,astro-ph.HE;Astrophysics;astro-ph.CO;gr-qc;Gravitation and Cosmology,2016,0,0,0,0,0,0,0,0,0,0,0,0,0,0,0,0,0,0,0,0,0,0,0,0,0,6,60,48,31,16
380,1478569,Exploring the Sensitivity of Next Generation Gravitational Wave Detectors,published;hep;core;citeable;arxiv,Class.Quant.Grav.,,,,,,CLASSICAL AND QUANTUM GRAVITY,3723,485,LIGO Scientific,LIGO,astro-ph.IM;Instrumentation;astro-ph.CO;Astrophysics,2017,0,0,0,0,0,0,0,0,0,0,0,0,0,0,0,0,0,0,0,0,0,0,0,0,1,1,33,90,143,213
381,1479757,The basic physics of the binary black hole merger GW150914,published;hep;core;citeable;arxiv,Annalen Phys.,,,,,,,,60,LIGO Scientific;Virgo,LIGO;VIRGO,gr-qc;Gravitation and Cosmology,2017,0,0,0,0,0,0,0,0,0,0,0,0,0,0,0,0,0,0,0,0,0,0,0,0,0,5,9,20,12,14
382,1480333,Overview of Advanced LIGO Adaptive Optics,hep;core;citeable;arxiv,Appl.Opt.,,,,,,,,29,aLIGO,aLIGO,physics.ins-det;Instrumentation;astro-ph.IM;physics.optics;General Physics,2016,0,0,0,0,0,0,0,0,0,0,0,0,0,0,0,0,0,0,0,0,0,0,0,0,0,2,2,5,7,13
383,1483407,Joint search for gravitational waves and high energy neutrinos with the VIRGO-LIGO and ANTARES detectors,hep;core;conferencepaper;citeable,PoS,1389798,,,,,,,,ANTARES;LIGO Scientific;VIRGO,ANTARES;VIRGO;LIGO,Astrophysics,2015,0,0,0,0,0,0,0,0,0,0,0,0,0,0,0,0,0,0,0,0,0,0,0,0,0,0,0,0,0,0
384,1483954,High-energy follow-up studies of gravitational wave transient events,hep;core;conferencepaper;citeable,PoS,1389798,,,,,,,,,LIGO;VIRGO,Astrophysics,2015,0,0,0,0,0,0,0,0,0,0,0,0,0,0,0,0,0,0,0,0,0,0,0,0,0,0,0,0,0,0
385,1492728,Measuring neutron star tidal deformability with Advanced LIGO: a Bayesian analysis of neutron star - black hole binary observations,published;hep;core;citeable;arxiv,Phys.Rev.,,,,,,PHYSICAL REVIEW D,14759,24,,LIGO,gr-qc;Gravitation and Cosmology,2017,0,0,0,0,0,0,0,0,0,0,0,0,0,0,0,0,0,0,0,0,0,0,0,0,0,0,1,3,7,13
386,1496611,All-sky search for short gravitational-wave bursts in the first Advanced LIGO run,published;hep;core;citeable;arxiv,Phys.Rev.,,,,,,PHYSICAL REVIEW D,14759,63,LIGO Scientific;Virgo,LIGO;VIRGO,gr-qc;Gravitation and Cosmology;astro-ph.HE;Astrophysics,2017,0,0,0,0,0,0,0,0,0,0,0,0,0,0,0,0,0,0,0,0,0,0,0,0,0,0,12,20,14,17
387,1499030,Inflationary primordial black holes for the LIGO gravitational wave events and pulsar timing array experiments,published;hep;core;citeable;arxiv,Phys.Rev.,,,,,,PHYSICAL REVIEW D,14759,116,,LIGO,astro-ph.CO;Astrophysics,2017,0,0,0,0,0,0,0,0,0,0,0,0,0,0,0,0,0,0,0,0,0,0,0,0,0,0,15,26,32,39
388,1499839,Effects of waveform model systematics on the interpretation of GW150914,published;hep;core;citeable;arxiv,Class.Quant.Grav.,,,,,Class. Quantum Grav. 34 (2017) 104002,CLASSICAL AND QUANTUM GRAVITY,3723,95,LIGO Scientific;Virgo,LIGO;VIRGO,gr-qc;Gravitation and Cosmology;astro-ph.HE;Astrophysics,2017,0,0,0,0,0,0,0,0,0,0,0,0,0,0,0,0,0,0,0,0,0,0,0,0,0,0,26,20,24,24
389,1499860,Search for Gravitational Waves Associated with Gamma-Ray Bursts During the First Advanced LIGO Observing Run and Implications for the Origin of GRB 150906B,published;hep;core;citeable;arxiv,Astrophys.J.,,,,,,ASTROPHYSICAL JOURNAL,2100,42,LIGO Scientific;Virgo;IPN,LIGO;VIRGO,astro-ph.HE;Astrophysics;gr-qc;Gravitation and Cosmology,2017,0,0,0,0,0,0,0,0,0,0,0,0,0,0,0,0,0,0,0,0,0,0,0,0,0,0,5,13,11,12
390,1499861,Bose-Einstein-condensed scalar field dark matter and the gravitational wave background from inflation: new cosmological constraints and its detectability by LIGO,published;hep;core;citeable;arxiv,Phys.Rev.,,,,,,PHYSICAL REVIEW D,14759,28,,LIGO,astro-ph.CO;Astrophysics;gr-qc;Gravitation and Cosmology,2017,0,0,0,0,0,0,0,0,0,0,0,0,0,0,0,0,0,0,0,0,0,0,0,0,0,0,3,9,9,7
391,1502061,Upper Limits on the Stochastic Gravitational-Wave Background from Advanced LIGOs First Observing Run,published;hep;core;citeable;arxiv,Phys.Rev.Lett.,,,,,,PHYSICAL REVIEW LETTERS,14761,218,LIGO Scientific;Virgo,LIGO;VIRGO,gr-qc;Gravitation and Cosmology;astro-ph.CO;Astrophysics;astro-ph.HE,2017,0,0,0,0,0,0,0,0,0,0,0,0,0,0,0,0,0,0,0,0,0,0,0,0,0,0,26,61,62,68
392,1502062,Directional Limits on Persistent Gravitational Waves from Advanced LIGOs First Observing Run,published;hep;core;citeable;arxiv,Phys.Rev.Lett.,,,,,,PHYSICAL REVIEW LETTERS,14761,70,LIGO Scientific;Virgo,LIGO;VIRGO,gr-qc;Gravitation and Cosmology;astro-ph.CO;Astrophysics;astro-ph.HE;astro-ph.IM;Instrumentation,2017,0,0,0,0,0,0,0,0,0,0,0,0,0,0,0,0,0,0,0,0,0,0,0,0,0,0,12,23,17,18
393,1502079,Updates to the Fermi-GBM Short GRB Targeted Offline Search in Preparation for LIGO's Second Observing Run,hep;core;citeable;arxiv,NA,,,,,,NA,NA,17,GBM-LIGO,LIGO,astro-ph.IM;Instrumentation;astro-ph.HE;Astrophysics;Instrumentation;Astrophysics,2016,0,0,0,0,0,0,0,0,0,0,0,0,0,0,0,0,0,0,0,0,0,0,0,0,0,0,3,3,7,4
394,1502089,Detectability of gravitational waves from binary black holes: Impact of precession and higher modes,published;hep;core;citeable;arxiv,Phys.Rev.,,,,,,PHYSICAL REVIEW D,14759,49,,LIGO,gr-qc;Gravitation and Cosmology,2017,0,0,0,0,0,0,0,0,0,0,0,0,0,0,0,0,0,0,0,0,0,0,0,0,0,0,8,12,8,21
395,1503357,Using galaxy formation simulations to optimize LIGO follow-up observations,published;hep;core;citeable;arxiv,Mon.Not.Roy.Astron.Soc.,,,,,,,,1,,LIGO,astro-ph.HE;Astrophysics,2017,0,0,0,0,0,0,0,0,0,0,0,0,0,0,0,0,0,0,0,0,0,0,0,0,0,0,0,0,0,1
396,1505712,Validating gravitational-wave detections: The Advanced LIGO hardware injection system,published;hep;core;citeable;arxiv,Phys.Rev.,,,,,,PHYSICAL REVIEW D,14759,30,,LIGO,astro-ph.IM;Instrumentation;gr-qc;Gravitation and Cosmology,2017,0,0,0,0,0,0,0,0,0,0,0,0,0,0,0,0,0,0,0,0,0,0,0,0,0,0,7,10,8,5
397,1507291,The most powerful astrophysical events: Gravitational-wave peak luminosity of binary black holes as predicted by numerical relativity,published;hep;core;citeable;arxiv,Phys.Rev.,,,,,"Phys. Rev. D 96, 024006 (2017)",PHYSICAL REVIEW D,14759,24,,LIGO,gr-qc;Gravitation and Cosmology;astro-ph.HE;Astrophysics,2017,0,0,0,0,0,0,0,0,0,0,0,0,0,0,0,0,0,0,0,0,0,0,0,0,0,0,7,5,3,9
398,1510858,First search for gravitational waves from known pulsars with Advanced LIGO,published;hep;core;citeable;arxiv,Astrophys.J.,,,,,,ASTROPHYSICAL JOURNAL,2100,128,LIGO Scientific;Virgo,LIGO;VIRGO,astro-ph.HE;Astrophysics;gr-qc;Gravitation and Cosmology,2017,0,0,0,0,0,0,0,0,0,0,0,0,0,0,0,0,0,0,0,0,0,0,0,0,0,0,23,42,38,25
399,1513271,Implications of the low binary black hole aligned spins observed by LIGO,published;hep;core;citeable;arxiv,Astrophys.J.,,,,,,ASTROPHYSICAL JOURNAL,2100,45,,LIGO,astro-ph.HE;Astrophysics;astro-ph.SR;gr-qc;Gravitation and Cosmology,2017,0,0,0,0,0,0,0,0,0,0,0,0,0,0,0,0,0,0,0,0,0,0,0,0,0,0,6,10,11,18
400,1513638,Effects of transients in LIGO suspensions on searches for gravitational waves,published;hep;core;citeable;arxiv,Rev.Sci.Instrum.,,,,,,REVIEW OF SCIENTIFIC INSTRUMENTS,16701,3,LSC Instrument;LIGO Scientific,LIGO,astro-ph.IM;Instrumentation,2017,0,0,0,0,0,0,0,0,0,0,0,0,0,0,0,0,0,0,0,0,0,0,0,0,0,0,0,1,2,0
401,1514388,GW150914: Observation of gravitational waves from a binary black hole merger,hep;core;conferencepaper;citeable,Nuovo Cim.,1514169,,,,,RIVISTA DEL NUOVO CIMENTO,17049,1,LIGO Scientific;VIRGO,LIGO;VIRGO,Gravitation and Cosmology,2017,0,0,0,0,0,0,0,0,0,0,0,0,0,0,0,0,0,0,0,0,0,0,0,0,0,0,0,1,0,0
402,1516543,Counting Black Holes: The Cosmic Stellar Remnant Population and Implications for LIGO,published;hep;core;citeable;arxiv,Mon.Not.Roy.Astron.Soc.,,,,,,,,37,,LIGO,astro-ph.GA;Astrophysics;astro-ph.HE;astro-ph.SR,2018,0,0,0,0,0,0,0,0,0,0,0,0,0,0,0,0,0,0,0,0,0,0,0,0,0,0,4,13,13,7
403,1518339,Search for High-energy Neutrinos from Gravitational Wave Event GW151226 and Candidate LVT151012 with ANTARES and IceCube,published;hep;core;citeable;arxiv,Phys.Rev.,,,,,,PHYSICAL REVIEW D,14759,62,ANTARES;IceCube;LIGO Scientific;Virgo,ANTARES;ICECUBE;LIGO;VIRGO,astro-ph.HE;Astrophysics,2017,0,0,0,0,0,0,0,0,0,0,0,0,0,0,0,0,0,0,0,0,0,0,0,0,0,0,12,12,19,16
404,1591085,Design of a tuned mass damper for high quality factor suspension modes in Advanced LIGO,hep;core;citeable;published,Rev.Sci.Instrum.,,,,,,REVIEW OF SCIENTIFIC INSTRUMENTS,16701,3,,AdvLIGO,Gravitation and Cosmology,2017,0,0,0,0,0,0,0,0,0,0,0,0,0,0,0,0,0,0,0,0,0,0,0,0,0,0,1,0,1,1
405,1591265,Results From The First Science Run Of Advanced GW Detectors,hep;core;conferencepaper,NA,1589812,9782954640099,,,,NA,NA,,LIGO Scientific,LIGO;VIRGO,Gravitation and Cosmology,2016,0,0,0,0,0,0,0,0,0,0,0,0,0,0,0,0,0,0,0,0,0,0,0,0,0,0,0,0,0,0
406,1591323,Search for gravitational waves from Scorpius X-1 in the first Advanced LIGO observing run with a hidden Markov model,published;hep;core;citeable;arxiv,Phys.Rev.,,,,,,PHYSICAL REVIEW D,14759,43,LIGO Scientific;VIRGO,LIGO;VIRGO,gr-qc;Gravitation and Cosmology,2017,0,0,0,0,0,0,0,0,0,0,0,0,0,0,0,0,0,0,0,0,0,0,0,0,0,0,5,10,13,15
407,1591690,Search for intermediate mass black hole binaries in the first observing run of Advanced LIGO,published;hep;core;citeable;arxiv,Phys.Rev.,,,,,,PHYSICAL REVIEW D,14759,82,LIGO Scientific;Virgo,AdvLIGO;VIRGO;LIGO,gr-qc;Gravitation and Cosmology,2017,0,0,0,0,0,0,0,0,0,0,0,0,0,0,0,0,0,0,0,0,0,0,0,0,0,0,12,27,26,17
408,1596535,Doing outreach with the first direct observation of gravitational waves,hep;core;conferencepaper;citeable,PoS,1507019,,,,,,,,Virgo;LIGO Scientific,VIRGO;LIGO,Gravitation and Cosmology,2016,0,0,0,0,0,0,0,0,0,0,0,0,0,0,0,0,0,0,0,0,0,0,0,0,0,0,0,0,0,0
409,1597097,The Influence of Dual-Recycling on Parametric Instabilities at Advanced LIGO,published;hep;core;citeable;arxiv,Class.Quant.Grav.,,,,,A C Green et al 2017 Class. Quantum Grav. 34 205004,CLASSICAL AND QUANTUM GRAVITY,3723,8,,LIGO,gr-qc;Gravitation and Cosmology;astro-ph.IM;Instrumentation;physics.optics;General Physics,2017,0,0,0,0,0,0,0,0,0,0,0,0,0,0,0,0,0,0,0,0,0,0,0,0,0,0,1,0,3,4
410,1600040,Data Access for LIGO on the OSG,conferencepaper;hep;core;citeable;arxiv,NA,,,,,,NA,NA,10,,LIGO,cs.DC;Computing;astro-ph.IM;Instrumentation,2017,0,0,0,0,0,0,0,0,0,0,0,0,0,0,0,0,0,0,0,0,0,0,0,0,0,0,1,1,4,3
411,1602288,Simulations as crucial tools for GW experiments,hep;core;conferencepaper,NA,1600276,,,,,NA,NA,,,LIGO,Instrumentation,2004,0,0,0,0,0,0,0,0,0,0,0,0,0,0,0,0,0,0,0,0,0,0,0,0,0,0,0,0,0,0
412,1602334,GW170104: Observation of a 50-Solar-Mass Binary Black Hole Coalescence at Redshift 0.2,published;hep;core;citeable;arxiv,Phys.Rev.Lett.,,,,,,PHYSICAL REVIEW LETTERS,14761,1955,LIGO Scientific;VIRGO,LIGO;VIRGO,Gravitation and Cosmology;Astrophysics,2017,0,0,0,0,0,0,0,0,0,0,0,0,0,0,0,0,0,0,0,0,0,0,0,0,1,1,234,650,553,496
413,1604232,Upper Limits on Gravitational Waves from Scorpius X-1 from a Model-Based Cross-Correlation Search in Advanced LIGO Data,published;hep;core;citeable;arxiv,Astrophys.J.,,,,,,ASTROPHYSICAL JOURNAL,2100,33,LIGO Scientific;Virgo,LIGO;VIRGO,astro-ph.HE;Astrophysics,2017,0,0,0,0,0,0,0,0,0,0,0,0,0,0,0,0,0,0,0,0,0,0,0,0,0,0,5,11,7,10
414,1605082,On the time lags of the LIGO signals,published;hep;core;citeable;arxiv,JCAP,,,,,,,,21,,LIGO,astro-ph.IM;Instrumentation;gr-qc;Gravitation and Cosmology,2017,0,0,0,0,0,0,0,0,0,0,0,0,0,0,0,0,0,0,0,0,0,0,0,0,0,0,3,9,5,3
415,1605547,Misaligned Spin Merging Black Holes in Modified Gravity (MOG),hep;core;citeable;arxiv,NA,,,,,,NA,NA,5,LIGO,LIGO,gr-qc;Gravitation and Cosmology;astro-ph.HE;Astrophysics;Gravitation and Cosmology;Astrophysics,2017,0,0,0,0,0,0,0,0,0,0,0,0,0,0,0,0,0,0,0,0,0,0,0,0,0,0,0,2,2,1
416,1606304,"Evolutionary roads leading to low effective spins, high black hole masses, and O1/O2 rates for LIGO/Virgo binary black holes",published;hep;core;citeable;arxiv,Astron.Astrophys.,,,,,"A&A 636, A104 (2020)",ASTRONOMY AND ASTROPHYSICS,2093,148,,LIGO,Astrophysics;astro-ph.HE;gr-qc,2020,0,0,0,0,0,0,0,0,0,0,0,0,0,0,0,0,0,0,0,0,0,0,0,0,0,0,5,28,34,81
417,1607217,Deep Transfer Learning: A new deep learning glitch classification method for advanced LIGO,hep;core;citeable;arxiv,NA,,,,,,NA,NA,17,,AdvLIGO,gr-qc;Gravitation and Cosmology;astro-ph.IM;Instrumentation;cs.CV;Computing;cs.LG;cs.NE;Gravitation and Cosmology;Instrumentation;Computing,2017,0,0,0,0,0,0,0,0,0,0,0,0,0,0,0,0,0,0,0,0,0,0,0,0,0,0,2,9,2,4
418,1607252,Data Analysis of Massive Gravitational Waves from Gamma Ray Bursts,published;hep;core;citeable;arxiv,Int.J.Mod.Phys.,,,,,,INTERNATIONAL JOURNAL OF MODERN PHYSICS A,8627,,,LIGO,gr-qc;Gravitation and Cosmology,2017,0,0,0,0,0,0,0,0,0,0,0,0,0,0,0,0,0,0,0,0,0,0,0,0,0,0,0,0,0,0
419,1607435,The Sound of Gravity,hep;core;conferencepaper;citeable,PoS,1607410,,,,,,,,LIGO Scientific;VIRGO,LIGO;VIRGO,Gravitation and Cosmology,2017,0,0,0,0,0,0,0,0,0,0,0,0,0,0,0,0,0,0,0,0,0,0,0,0,0,0,0,0,0,0
420,1609208,All-sky Search for Periodic Gravitational Waves in the O1 LIGO Data,published;hep;core;citeable;arxiv,Phys.Rev.,,,,,,PHYSICAL REVIEW D,14759,63,LIGO Scientific;Virgo,LIGO;VIRGO,gr-qc;Gravitation and Cosmology;astro-ph.IM;Instrumentation,2017,0,0,0,0,0,0,0,0,0,0,0,0,0,0,0,0,0,0,0,0,0,0,0,0,0,0,5,28,16,14
421,1609228,First low-frequency Einstein@Home all-sky search for continuous gravitational waves in Advanced LIGO data,published;hep;core;citeable;arxiv,Phys.Rev.,,,,,,PHYSICAL REVIEW D,14759,52,LIGO Scientific;Virgo,LIGO;VIRGO,gr-qc;Gravitation and Cosmology,2017,0,0,0,0,0,0,0,0,0,0,0,0,0,0,0,0,0,0,0,0,0,0,0,0,0,0,4,16,12,20
422,1609554,Realisation Of The ALIGO Fused Silica Suspension,hep;conferencepaper,NA,1268858,,,,,NA,NA,,,AdvLIGO,Instrumentation,2011,0,0,0,0,0,0,0,0,0,0,0,0,0,0,0,0,0,0,0,0,0,0,0,0,0,0,0,0,0,0
423,1609613,What if LIGOs gravitational wave detections are strongly lensed by massive galaxy clusters?,published;hep;core;citeable;arxiv,Mon.Not.Roy.Astron.Soc.,,,,,,,,41,,LIGO,astro-ph.HE;Astrophysics;astro-ph.GA,2018,0,0,0,0,0,0,0,0,0,0,0,0,0,0,0,0,0,0,0,0,0,0,0,0,0,0,0,6,13,22
424,1614634,Optimally setting up directed searches for continuous gravitational waves in Advanced LIGO O1 data,published;hep;core;citeable;arxiv,Phys.Rev.,,,,,,PHYSICAL REVIEW D,14759,11,,LIGO,gr-qc;Gravitation and Cosmology,2018,0,0,0,0,0,0,0,0,0,0,0,0,0,0,0,0,0,0,0,0,0,0,0,0,0,0,2,3,2,4
425,1615808,Calibration uncertainty for Advanced LIGOs first and second observing runs,hep;core;citeable;published,Phys.Rev.,,,,,,PHYSICAL REVIEW D,14759,78,LIGO Scientific,LIGO,Instrumentation;astro-ph.IM;Instrumentation,2017,0,0,0,0,0,0,0,0,0,0,0,0,0,0,0,0,0,0,0,0,0,0,0,0,0,0,4,14,28,32
