,ID,Title,Type,Venue Name,Venue ID,Venue ISBN,Venue Acronym,Venue Presented At,Venue Extra,Venue Map Name,Venue Map ID,Citations,Collaborations,Experiments,Classification,Year,Citations 1991,Citations 1992,Citations 1993,Citations 1994,Citations 1995,Citations 1996,Citations 1997,Citations 1998,Citations 1999,Citations 2000,Citations 2001,Citations 2002,Citations 2003,Citations 2004,Citations 2005,Citations 2006,Citations 2007,Citations 2008,Citations 2009,Citations 2010,Citations 2011,Citations 2012,Citations 2013,Citations 2014,Citations 2015,Citations 2016,Citations 2017,Citations 2018,Citations 2019,Citations 2020
267,1124295,Einstein@Home all-sky search for periodic gravitational waves in LIGO S5 data,published;hep;core;citeable;arxiv,Phys.Rev.,,,,,,PHYSICAL REVIEW D,14759,95,LIGO Scientific;VIRGO,LIGO;VIRGO,Astrophysics;Gravitation and Cosmology,2013,0,0,0,0,0,0,0,0,0,0,0,0,0,0,0,0,0,0,0,0,0,0,9,16,22,21,11,6,4,5
268,1126435,Scattered light control in advanced LIGO,hep;core;conferencepaper,NA,1197687,,,To appear in the proceedings of,,NA,NA,1,,LIGO,Gravitation and Cosmology;Instrumentation,2009,0,0,0,0,0,0,0,0,0,0,0,0,0,0,0,0,0,0,0,0,0,0,0,0,0,0,0,0,1,0
269,1126438,Progress on the Monolithic suspension for advanced LIGO,hep;core;conferencepaper,NA,1197687,,,To appear in the proceedings of,,NA,NA,,,LIGO,Gravitation and Cosmology;Instrumentation;Gravitation and Cosmology;Instrumentation,2009,0,0,0,0,0,0,0,0,0,0,0,0,0,0,0,0,0,0,0,0,0,0,0,0,0,0,0,0,0,0
270,1126440,LIGO and VIRGO gravitational waves data analysis,hep;core;conferencepaper,NA,1197687,,,To appear in the proceedings of,,NA,NA,,,LIGO;VIRGO,Gravitation and Cosmology,2009,0,0,0,0,0,0,0,0,0,0,0,0,0,0,0,0,0,0,0,0,0,0,0,0,0,0,0,0,0,0
271,1186432,Searches for gravitational wave signals from rotating neutron stars,hep;core;conferencepaper;citeable,J.Phys.Conf.Ser.,,,,,,Journal of Physics: Conference Series,11180,1,LIGO Scientific;VIRGO,LIGO;VIRGO,Astrophysics;Astrophysics,2012,0,0,0,0,0,0,0,0,0,0,0,0,0,0,0,0,0,0,0,0,0,0,0,0,1,0,0,0,0,0
272,1186433,Astronomy and astrophysics with gravitational waves in the advanced detector era,hep;core;conferencepaper;citeable,J.Phys.Conf.Ser.,,,,,,Journal of Physics: Conference Series,11180,1,LIGO Scientific;VIRGO,LIGO;VIRGO,Astrophysics,2012,0,0,0,0,0,0,0,0,0,0,0,0,0,0,0,0,0,0,0,0,0,0,0,0,0,1,0,0,0,0
273,1186799,Searches for gravitational-wave events in coincidence with gamma events,hep;core;conferencepaper;citeable,Nuovo Cim.,,,,,,RIVISTA DEL NUOVO CIMENTO,17049,,LIGO Scientific;VIRGO,LIGO;VIRGO,Gravitation and Cosmology,2011,0,0,0,0,0,0,0,0,0,0,0,0,0,0,0,0,0,0,0,0,0,0,0,0,0,0,0,0,0,0
274,1188659,"Search for gravitational waves from binary black hole inspiral, merger, and ringdown in LIGO-Virgo data from 20092010",published;hep;core;citeable;arxiv,Phys.Rev.,,,,,,PHYSICAL REVIEW D,14759,115,LIGO Scientific;VIRGO,LIGO;VIRGO,Astrophysics;Gravitation and Cosmology,2013,0,0,0,0,0,0,0,0,0,0,0,0,0,0,0,0,1,0,0,0,0,1,14,32,23,21,5,6,1,1
275,1189498,"First joint analysis between gravitational waves and high energy neutrinos using LIGO, Virgo and ANTARES data",hep;core;conferencepaper;citeable,J.Phys.Conf.Ser.,,,,,,Journal of Physics: Conference Series,11180,,ANTARES;LIGO Scientific;VIRGO,ANTARES;LIGO;VIRGO,Astrophysics;Gravitation and Cosmology,2012,0,0,0,0,0,0,0,0,0,0,0,0,0,0,0,0,0,0,0,0,0,0,0,0,0,0,0,0,0,0
276,1193744,Data analysis challenges in transient gravitational-wave astronomy,hep;core;conferencepaper;citeable,AIP Conf.Proc.,1694005,,,,,AIP CONFERENCE PROCEEDINGS,907,3,LIGO Scientific;VIRGO,LIGO;VIRGO,Astrophysics;Gravitation and Cosmology;gr-qc;astro-ph.IM;physics.data-an,2013,0,0,0,0,0,0,0,0,0,0,0,0,0,0,0,0,0,0,0,0,0,0,0,0,0,0,1,0,2,0
277,1197456,Searches for continuous gravitational waves with the LIGO and Virgo detector,hep;core;conferencepaper;citeable,IAU Symp.,1207544,,,,,IAU SYMPOSIA,7531,1,LIGO Scientific;VIRGO,LIGO;VIRGO,Astrophysics;Gravitation and Cosmology;gr-qc;astro-ph.GA;astro-ph.IM,2013,0,0,0,0,0,0,0,0,0,0,0,0,0,0,0,0,0,0,0,0,0,0,0,0,0,0,1,0,0,0
278,1226234,"Prospects for Observing and Localizing Gravitational-Wave Transients with Advanced LIGO, Advanced Virgo and KAGRA",published;hep;core;review;citeable,Living Rev.Rel.,,,,,,,,1188,KAGRA;LIGO Scientific;VIRGO,LIGO;VIRGO,Gravitation and Cosmology;gr-qc;astro-ph.HE,2018,0,0,0,0,0,0,0,0,0,0,0,0,0,0,0,0,0,0,0,0,0,0,30,88,81,85,138,179,229,342
279,1227366,Parameter estimation for compact binary coalescence signals with the first generation gravitational-wave detector network,published;hep;core;citeable;arxiv,Phys.Rev.,,,,,,PHYSICAL REVIEW D,14759,152,LIGO Scientific;VIRGO,LIGO;Virgo,gr-qc;astro-ph.HE;Gravitation and Cosmology;Astrophysics,2013,0,0,0,0,0,0,0,0,0,0,0,0,0,1,2,0,0,0,0,0,0,0,13,41,25,24,10,12,4,14
280,1235480,First Test of High Frequency Gravity Waves from Inflation using ADVANCED LIGO,published;hep;core;citeable;arxiv,JCAP,,,,,,,,12,,LIGO,astro-ph.HE;gr-qc;Gravitation and Cosmology;Astrophysics,2015,0,0,0,0,0,0,0,0,0,0,0,0,0,0,0,0,0,0,0,0,0,0,0,2,2,0,1,4,3,0
281,1235484,X-ray Transients in the Advanced LIGO/Virgo Horizon,hep;core;citeable;published,Astrophys.J.,,,,,,ASTROPHYSICAL JOURNAL,2100,14,,VIRGO;LIGO,Astrophysics;astro-ph.HE;astro-ph.CO,2013,0,0,0,0,0,0,0,0,0,0,0,0,0,0,0,0,0,0,0,0,0,0,2,2,2,5,1,0,1,1
282,1239548,Searches for Gravitational Wave Transients in the LIGO and VIRGO Data,hep;core;conferencepaper,NA,1268858,,,,,NA,NA,,LIGO Scientific;VIRGO,LIGO;VIRGO,Gravitation and Cosmology,2011,0,0,0,0,0,0,0,0,0,0,0,0,0,0,0,0,0,0,0,0,0,0,0,0,0,0,0,0,0,0
283,1249443,Enhancing the sensitivity of the LIGO gravitational wave detector by using squeezed states of light,published;hep;core;citeable;arxiv,Nature Photon.,,,,,,,,252,LIGO Scientific,LIGO,quant-ph;General Physics;physics.optics;physics.optics,2013,0,0,0,0,0,0,0,0,0,0,0,0,0,0,0,0,0,0,0,0,0,0,8,27,24,21,28,33,41,64
284,1254206,Gravitational waves from known pulsars: results from the initial detector era,published;hep;core;citeable;arxiv,Astrophys.J.,,,,,,ASTROPHYSICAL JOURNAL,2100,133,LIGO Scientific,LIGO,astro-ph.HE;gr-qc;Gravitation and Cosmology;Astrophysics,2014,0,0,0,0,0,0,0,0,0,0,0,0,0,0,0,0,0,0,0,0,0,0,0,15,23,24,24,13,14,12
285,1255282,Search for long-lived gravitational-wave transients coincident with long gamma-ray bursts,published;hep;core;citeable;arxiv,Phys.Rev.,,,,,,PHYSICAL REVIEW D,14759,35,LIGO Scientific;VIRGO,LIGO;VIRGO,astro-ph.HE;gr-qc;Gravitation and Cosmology;Astrophysics,2013,0,0,0,0,0,0,0,0,0,0,0,0,0,0,0,0,0,0,0,0,0,0,1,7,10,5,6,2,0,2
286,1255289,Directed search for continuous gravitational waves from the Galactic center,published;hep;core;citeable;arxiv,Phys.Rev.,,,,,,PHYSICAL REVIEW D,14759,60,LIGO Scientific;VIRGO,LIGO;VIRGO,gr-qc;astro-ph.HE;Gravitation and Cosmology;Astrophysics,2013,0,0,0,0,0,0,0,0,0,0,0,0,0,0,0,0,0,0,0,0,0,0,1,6,7,13,9,9,7,5
287,1257716,First Searches for Optical Counterparts to Gravitational-wave Candidate Events,published;hep;core;citeable;arxiv,Astrophys.J.Suppl.,,,,,,,,58,LIGO Scientific;VIRGO,VIRGO;LIGO,astro-ph.IM;astro-ph.HE;Instrumentation;Astrophysics,2014,0,0,0,0,0,0,0,0,0,0,0,0,0,0,0,0,0,0,0,0,0,0,0,8,17,13,7,4,3,1
288,1257719,Constraints on cosmic strings from the LIGO-Virgo gravitational-wave detectors,published;hep;core;citeable;arxiv,Phys.Rev.Lett.,,,,,"Phys. Rev. Lett. 112, 131101 (2014)",PHYSICAL REVIEW LETTERS,14761,72,LIGO Scientific;VIRGO,LIGO;VIRGO,gr-qc;astro-ph.CO;Gravitation and Cosmology;Astrophysics;Gravitation and Astrophysics,2014,0,0,0,0,0,0,0,0,0,0,0,0,0,0,0,0,0,0,0,0,0,0,0,7,10,9,16,7,8,13
289,1264001,Application of a Hough search for continuous gravitational waves on data from the fifth LIGO science run,published;hep;core;citeable;arxiv,Class.Quant.Grav.,,,,,,CLASSICAL AND QUANTUM GRAVITY,3723,27,LIGO Scientific;VIRGO,LIGO;VIRGO,gr-qc;Gravitation and Cosmology,2014,0,0,0,0,0,0,0,0,0,0,0,0,0,0,0,0,0,0,0,0,0,0,0,2,2,6,8,4,3,1
290,1276073,The NINJA-2 project: Detecting and characterizing gravitational waveforms modelled using numerical binary black hole simulations,published;hep;core;citeable;arxiv,Class.Quant.Grav.,,,,,,CLASSICAL AND QUANTUM GRAVITY,3723,58,LIGO Scientific;VIRGO;NINJA-2,LIGO;VIRGO,gr-qc;astro-ph.CO;Gravitation and Cosmology;Astrophysics,2014,0,0,0,0,0,0,0,0,0,0,0,0,0,0,0,0,0,0,0,0,0,0,0,12,13,12,9,3,4,4
291,1281453,Gravitational wave: gamma-ray burst connections,published;core;citeable;hep,Phil.Trans.Roy.Soc.Lond.,,,,,,,,2,LIGO Scientific,LIGO,Gravitation and Cosmology,2007,0,0,0,0,0,0,0,0,0,0,0,0,0,0,0,0,0,0,0,0,0,0,2,0,0,0,0,0,0,0
292,1282007,Implementation of an $\mathcal{F}$-statistic all-sky search for continuous gravitational waves in Virgo VSR1 data,published;hep;core;citeable;arxiv,Class.Quant.Grav.,,,,,,CLASSICAL AND QUANTUM GRAVITY,3723,37,LIGO Scientific;VIRGO,LIGO;VIRGO,gr-qc;astro-ph.HE;astro-ph.IM;Gravitation and Cosmology;Astrophysics;Instrumentation,2014,0,0,0,0,0,0,0,0,0,0,0,0,0,0,0,0,0,0,0,0,0,0,0,1,5,8,9,6,4,2
293,1283057,A gravitational wave detector operating beyond the quantum shot-noise limit: Squeezed light in application,hep;core;conferencepaper;citeable,EPJ Web Conf.,1256393,,,,,,,,LIGO Scientific,LIGO,Gravitation and Cosmology,2013,0,0,0,0,0,0,0,0,0,0,0,0,0,0,0,0,0,0,0,0,0,0,0,0,0,0,0,0,0,0
294,1286060,Multimessenger astrophysics: When gravitational waves meet high energy neutrinos,hep;core;conferencepaper;citeable,Nucl.Instrum.Meth.,1286964,,,,,NUCLEAR INSTRUMENTS & METHODS IN PHYSICS RESEARCH SECTION A-ACCELERATORS SPECTROMETERS DETECTORS AND ASSOCIATED EQUIPMENT,13913,1,ANTARES;LIGO Scientific;VIRGO,ANTARES;VIRGO;LIGO,Astrophysics,2014,0,0,0,0,0,0,0,0,0,0,0,0,0,0,0,0,0,0,0,0,0,0,0,0,0,0,0,0,0,1
295,1286752,Search for gravitational wave ringdowns from perturbed intermediate mass black holes in LIGO-Virgo data from 20052010,published;hep;core;citeable;arxiv,Phys.Rev.,,,,,,PHYSICAL REVIEW D,14759,32,LIGO Scientific;VIRGO,LIGO;VIRGO,gr-qc;Gravitation and Cosmology,2014,0,0,0,0,0,0,0,0,0,0,0,0,0,0,0,0,0,0,0,0,0,0,0,4,5,8,3,6,1,2
296,1287320,Search for gravitational waves associated with $\gamma$-ray bursts detected by the Interplanetary Network,published;hep;core;citeable;arxiv,Phys.Rev.Lett.,,,,,,PHYSICAL REVIEW LETTERS,14761,45,LIGO Scientific;VIRGO;IPN,LIGO;VIRGO,astro-ph.HE;gr-qc;Gravitation and Cosmology;Astrophysics;Gravitation and Astrophysics,2014,0,0,0,0,0,0,0,0,0,0,0,0,0,0,0,0,0,0,0,0,0,0,0,5,9,9,11,7,0,4
297,1289036,Search for gravitational radiation from intermediate mass black hole binaries in data from the second LIGO-Virgo joint science run,hep;core;citeable;published,Phys.Rev.,,,,,"Phys. Rev. D 89, 122003 (2014)",PHYSICAL REVIEW D,14759,36,LIGO Scientific;VIRGO,LIGO;VIRGO,Gravitation and Cosmology;Astrophysics;gr-qc;astro-ph.HE,2014,0,0,0,0,0,0,0,0,0,0,0,0,0,0,0,0,0,0,0,0,0,0,0,2,5,9,6,6,2,4
298,1294627,"Methods and results of a search for gravitational waves associated with gamma-ray bursts using the GEO600, LIGO, and Virgo detectors",published;hep;core;citeable;arxiv,Phys.Rev.,,,,,"Phys. Rev. D 89 (2014), 122004",PHYSICAL REVIEW D,14759,26,LIGO Scientific;VIRGO,LIGO;VIRGO,astro-ph.HE;Astrophysics;Gravitational Experiment,2014,0,0,0,0,0,0,0,0,0,0,0,0,0,0,0,0,0,0,0,0,0,0,0,3,4,6,3,4,2,3
299,1298692,First all-sky search for continuous gravitational waves from unknown sources in binary systems,published;hep;core;citeable;arxiv,Phys.Rev.,,,,,,PHYSICAL REVIEW D,14759,60,LIGO Scientific;VIRGO,LIGO;VIRGO,gr-qc;astro-ph.HE;Gravitation and Cosmology;Astrophysics;Gravitational Experiment,2014,0,0,0,0,0,0,0,0,0,0,0,0,0,0,0,0,0,0,0,0,0,0,0,1,10,12,16,7,6,6
300,1301192,Improved Upper Limits on the Stochastic Gravitational-Wave Background from 20092010 LIGO and Virgo Data,published;hep;core;citeable;arxiv,Phys.Rev.Lett.,,,,,,PHYSICAL REVIEW LETTERS,14761,98,LIGO Scientific;VIRGO,LIGO;VIRGO,gr-qc;astro-ph.CO;astro-ph.HE;Gravitation and Cosmology;Astrophysics;Gravitation and Astrophysics,2014,0,0,0,0,0,0,0,0,0,0,0,0,0,0,0,0,0,0,0,0,0,0,0,3,28,24,19,14,7,2
301,1304914,Multimessenger search for sources of gravitational waves and high-energy neutrinos: Initial results for LIGO-Virgo and IceCube,published;hep;core;citeable;arxiv,Phys.Rev.,,,,,,PHYSICAL REVIEW D,14759,46,IceCube;LIGO Scientific;VIRGO,ICECUBE;LIGO;VIRGO,astro-ph.HE;Astrophysics;Gravitational Experiment,2014,0,0,0,0,0,0,0,0,0,0,0,0,0,0,0,0,0,0,0,0,0,0,0,2,7,6,13,3,5,6
302,1315656,The detection efficiency of on-axis short gamma ray burst optical afterglows triggered by aLIGO/Virgo,published;hep;core;citeable;arxiv,Mon.Not.Roy.Astron.Soc.,,,,,,,,10,,LIGO;VIRGO,astro-ph.HE;astro-ph.HE;Astrophysics,2014,0,0,0,0,0,0,0,0,0,0,0,0,0,0,0,0,0,0,0,0,0,0,0,0,2,2,2,3,1,0
303,1317939,Environmental Influences on the LIGO Gravitational Wave Detectors during the 6th Science Run,published;hep;core;citeable;arxiv,Class.Quant.Grav.,,,,,,CLASSICAL AND QUANTUM GRAVITY,3723,49,,LIGO,astro-ph.IM;Instrumentation,2015,0,0,0,0,0,0,0,0,0,0,0,0,0,0,0,0,0,0,0,0,0,0,0,1,1,10,10,4,4,19
304,1319985,High-energy electromagnetic offline follow-up of LIGO-Virgo gravitational-wave binary coalescence candidate events,published;hep;core;citeable;arxiv,Astrophys.J.Suppl.,,,,,,,,36,,LIGO;VIRGO,astro-ph.HE;astro-ph.HE;Astrophysics,2015,0,0,0,0,0,0,0,0,0,0,0,0,0,0,0,0,0,0,0,0,0,0,0,0,0,6,9,7,7,7
305,1322875,The LIGO Open Science Center,conferencepaper;hep;core;citeable;arxiv,J.Phys.Conf.Ser.,1369421,,,,,Journal of Physics: Conference Series,11180,163,,LIGO,gr-qc;astro-ph.HE;astro-ph.IM;Gravitation and Cosmology;Astrophysics;Instrumentation,2015,0,0,0,0,0,0,0,0,0,0,0,0,0,0,0,0,0,0,0,0,0,0,0,0,1,4,6,20,54,76
306,1323409,Searching for stochastic gravitational waves using data from the two colocated LIGO Hanford detectors,published;hep;core;citeable;arxiv,Phys.Rev.,,,,,,PHYSICAL REVIEW D,14759,37,LIGO Scientific;VIRGO,LIGO;VIRGO,gr-qc;astro-ph.IM;Gravitation and Cosmology;Instrumentation;Gravitational Experiment,2015,0,0,0,0,0,0,0,0,0,0,0,0,0,0,0,0,0,0,0,0,0,0,0,0,3,10,9,6,3,5
307,1323505,Observational results from the LIGO and Virgo detectors,published;hep;core;review;citeable,Gen.Rel.Grav.,,,,,,,,2,LIGO Scientific;VIRGO,VIRGO;LIGO,Gravitation and Cosmology,2014,0,0,0,0,0,0,0,0,0,0,0,0,0,0,0,0,0,0,0,0,0,0,0,0,1,0,0,0,0,1
308,1323506,Gravitational wave detection with advanced ground based detectors,published;core;citeable;hep,Gen.Rel.Grav.,,,,,,,,6,LIGO Scientific;VIRGO;KAGRA,VIRGO;LIGO,Gravitation and Cosmology,2014,0,0,0,0,0,0,0,0,0,0,0,0,0,0,0,0,0,0,0,0,0,0,0,0,0,4,0,2,0,0
309,1324772,Characterization of the LIGO detectors during their sixth science run,published;hep;core;citeable;arxiv,Class.Quant.Grav.,,,,,,CLASSICAL AND QUANTUM GRAVITY,3723,364,LIGO Scientific;VIRGO,LIGO;VIRGO,gr-qc;astro-ph.IM;Gravitation and Cosmology;Instrumentation,2015,0,0,0,0,0,0,0,0,0,0,0,0,0,0,0,0,0,0,0,0,0,0,0,1,7,39,42,55,92,123
310,1325075,Narrow-band search of continuous gravitational-wave signals from Crab and Vela pulsars in Virgo VSR4 data,published;hep;core;citeable;arxiv,Phys.Rev.,,,,,,PHYSICAL REVIEW D,14759,37,LIGO Scientific;VIRGO,LIGO;VIRGO,astro-ph.IM;astro-ph.IM;astro-ph.HE;astro-ph.HE;gr-qc;Gravitation and Cosmology;Instrumentation;Astrophysics,2015,0,0,0,0,0,0,0,0,0,0,0,0,0,0,0,0,0,0,0,0,0,0,0,0,6,5,11,7,4,4
311,1328453,Advanced LIGO,published;hep;core;citeable;arxiv,Class.Quant.Grav.,,,,,,CLASSICAL AND QUANTUM GRAVITY,3723,1460,LIGO Scientific,ALIGO;LIGO,gr-qc;Gravitation and Cosmology;astro-ph.IM;Instrumentation;physics.ins-det;Astrophysics,2014,0,0,0,0,0,0,0,0,0,0,0,0,0,0,0,0,0,0,0,0,0,0,0,1,93,182,204,230,258,473
312,1329861,Status of GEO 600,hep;core;conferencepaper;citeable,J.Phys.Conf.Ser.,1369421,,,,,Journal of Physics: Conference Series,11180,12,LIGO Scientific,LIGO,Instrumentation;physics.ins-det;astro-ph.IM,2015,0,0,0,0,0,0,0,0,0,0,0,0,0,0,0,0,0,0,0,0,0,0,0,0,4,1,4,1,0,2
313,1331514,Achieving resonance in the Advanced LIGO gravitational-wave interferometer,published;core;citeable;hep,Class.Quant.Grav.,,,,,,CLASSICAL AND QUANTUM GRAVITY,3723,36,,LIGO,Instrumentation,2014,0,0,0,0,0,0,0,0,0,0,0,0,0,0,0,0,0,0,0,0,0,0,0,1,4,8,5,4,5,9
314,1331750,Directed search for gravitational waves from Scorpius X-1 with initial LIGO data,published;hep;core;citeable;arxiv,Phys.Rev.,,,,,,PHYSICAL REVIEW D,14759,43,LIGO Scientific;VIRGO,LIGO;VIRGO,gr-qc;Gravitation and Cosmology;astro-ph.HE;Astrophysics,2015,0,0,0,0,0,0,0,0,0,0,0,0,0,0,0,0,0,0,0,0,0,0,0,0,8,8,12,5,7,3
315,1334902,Searches for continuous gravitational waves from nine young supernova remnants,published;hep;core;citeable;arxiv,Astrophys.J.,,,,,,ASTROPHYSICAL JOURNAL,2100,62,LIGO Scientific,LIGO,astro-ph.HE;Astrophysics,2015,0,0,0,0,0,0,0,0,0,0,0,0,0,0,0,0,0,0,0,0,0,0,0,0,1,13,14,17,8,8
316,1339361,The needle in the hundred square degree haystack: The hunt for binary neutron star mergers with LIGO and Palomar Transient Factory,thesis;hep;core;citeable;arxiv,NA,,,,,,NA,NA,2,,LIGO;PTF,gr-qc;Gravitation and Cosmology;astro-ph.HE;Astrophysics;astro-ph.IM;Instrumentation,2015,0,0,0,0,0,0,0,0,0,0,0,0,0,0,0,0,0,0,0,0,0,0,0,0,1,1,0,0,0,0
317,1344579,Stochastic Gravitational-wave Background,hep;core;conferencepaper,NA,1278760,,,,,NA,NA,,LIGO Scientific;VIRGO,VIRGO;LIGO,Gravitation and Cosmology,2015,0,0,0,0,0,0,0,0,0,0,0,0,0,0,0,0,0,0,0,0,0,0,0,0,0,0,0,0,0,0
318,1344586,The Invisible Messengers: the 2007 Data Search Between Gravitational Waves and High Energy Neutrinos,hep;core;conferencepaper,NA,1278760,,,,,NA,NA,,ANTARES;LIGO Scientific;VIRGO,ANTARES;LIGO;VIRGO,Gravitation and Cosmology,2015,0,0,0,0,0,0,0,0,0,0,0,0,0,0,0,0,0,0,0,0,0,0,0,0,0,0,0,0,0,0
319,1344588,Search for Continuous Gravitational Waves From Known Neutron Stars: Status and Future Prospects,hep;core;conferencepaper,NA,1278760,,,,,NA,NA,,LIGO Scientific;VIRGO,LIGO;VIRGO,Gravitation and Cosmology,2015,0,0,0,0,0,0,0,0,0,0,0,0,0,0,0,0,0,0,0,0,0,0,0,0,0,0,0,0,0,0
320,1345945,Quantum noise reduction using squeezed states in LIGO,hep;thesis;core,NA,,,,,,NA,NA,2,,LIGO,Astrophysics;Instrumentation,2013,0,0,0,0,0,0,0,0,0,0,0,0,0,0,0,0,0,0,0,0,0,0,0,1,0,0,0,0,0,0
321,1353737,Observational Prospects in the Electromagnetic Domain of Gravitational Wave Sources,hep;core;conferencepaper;citeable,Frascati Phys.Ser.,1353716,,,,,,,,LIGO Scientific;VIRGO,VIRGO;LIGO,Astrophysics,2014,0,0,0,0,0,0,0,0,0,0,0,0,0,0,0,0,0,0,0,0,0,0,0,0,0,0,0,0,0,0
322,1355524,Regression of Environmental Noise in LIGO Data,published;hep;core;citeable;arxiv,Class.Quant.Grav.,,,,,,CLASSICAL AND QUANTUM GRAVITY,3723,23,,LIGO,gr-qc;Gravitation and Cosmology;astro-ph.IM;Instrumentation,2015,0,0,0,0,0,0,0,0,0,0,0,0,0,0,0,0,0,0,0,0,0,0,0,0,1,2,4,3,6,7
323,1356372,LIGO/Virgo/GEO/KAGRA Science,hep;core;conferencepaper;citeable,ASP Conf.Ser.,1356849,,,,,,,,,LIGO;VIRGO,Astrophysics,2013,0,0,0,0,0,0,0,0,0,0,0,0,0,0,0,0,0,0,0,0,0,0,0,0,0,0,0,0,0,0
324,1369425,Advanced LIGO status,hep;core;conferencepaper;citeable,J.Phys.Conf.Ser.,1369421,,,,,Journal of Physics: Conference Series,11180,4,LIGO Scientific,LIGO,Instrumentation;Gravitation and Cosmology,2015,0,0,0,0,0,0,0,0,0,0,0,0,0,0,0,0,0,0,0,0,0,0,0,0,0,1,0,1,0,2
325,1370669,Gravitational wave searches with Advanced LIGO and Advanced Virgo,hep;core;conferencepaper;citeable,NA,1402669,,,,,NA,NA,2,LIGO Scientific;VIRGO,VIRGO;LIGO,Gravitation and Cosmology;gr-qc,2015,0,0,0,0,0,0,0,0,0,0,0,0,0,0,0,0,0,0,0,0,0,0,0,0,1,1,0,0,0,0
326,1371859,Dimension-seven operators in the standard model with right handed neutrinos,published;hep;core;citeable;arxiv,Phys.Rev.,,,,,,PHYSICAL REVIEW D,14759,43,,LIGO;VIRGO,hep-ph;Phenomenology-HEP,2016,0,0,0,0,0,0,0,0,0,0,0,0,0,0,0,0,0,0,0,0,0,0,0,0,0,3,7,6,11,16
327,1375002,Planned search for LIGO-GBM coincidence in the first advanced LIGO data run,conferencepaper;hep;core;citeable;arxiv,NA,1402669,,,,,NA,NA,,,LIGO,astro-ph.HE;Astrophysics,2015,0,0,0,0,0,0,0,0,0,0,0,0,0,0,0,0,0,0,0,0,0,0,0,0,0,0,0,0,0,0
328,1381741,Low latency search for compact binary coalescences using MBTA,hep;conferencepaper;citeable;arxiv,NA,,,,,,NA,NA,2,LIGO Scientific;VIRGO,VIRGO;LIGO,gr-qc;Gravitation and Cosmology;astro-ph.IM;Instrumentation,2015,0,0,0,0,0,0,0,0,0,0,0,0,0,0,0,0,0,0,0,0,0,0,0,0,0,0,0,0,0,2
329,1390951,Improving the Data Quality of Advanced LIGO Based on Early Engineering Run Results,published;hep;core;citeable;arxiv,Class.Quant.Grav.,,,,,,CLASSICAL AND QUANTUM GRAVITY,3723,40,,LIGO,gr-qc;Gravitation and Cosmology;astro-ph.IM;Instrumentation,2015,0,0,0,0,0,0,0,0,0,0,0,0,0,0,0,0,0,0,0,0,0,0,0,0,0,8,5,10,4,13
330,1391115,Beyond the Horizon Distance: LIGO-Virgo can Boost Gravitational Wave Detection Rates by Exploiting the Mass Distribution of Neutron Stars,published;hep;core;citeable;arxiv,Phys.Rev.Lett.,,,,,,PHYSICAL REVIEW LETTERS,14761,7,,LIGO,astro-ph.HE;Astrophysics,2015,0,0,0,0,0,0,0,0,0,0,0,0,0,0,0,0,0,0,0,0,0,0,0,0,0,2,0,2,2,1
331,1397593,Search of the Orion spur for continuous gravitational waves using a loosely coherent algorithm on data from LIGO interferometers,published;hep;core;citeable;arxiv,Phys.Rev.,,,,,,PHYSICAL REVIEW D,14759,15,LIGO Scientific;VIRGO,LIGO;VIRGO,gr-qc;Gravitation and Cosmology;astro-ph.HE;Astrophysics,2016,0,0,0,0,0,0,0,0,0,0,0,0,0,0,0,0,0,0,0,0,0,0,0,0,0,2,3,5,3,2
332,1397602,First low frequency all-sky search for continuous gravitational wave signals,hep;core;citeable;published,Phys.Rev.,,,,,"Phys. Rev. D 93, 042007 (2016)",PHYSICAL REVIEW D,14759,36,LIGO Scientific;VIRGO,LIGO;VIRGO,Instrumentation;Astrophysics;Gravitation and Cosmology;astro-ph.IM;astro-ph.HE;gr-qc,2016,0,0,0,0,0,0,0,0,0,0,0,0,0,0,0,0,0,0,0,0,0,0,0,0,0,8,11,9,3,4
333,1400714,DQTunePipe: A set of Python tools for LIGO detector characterization,hep;thesis,NA,,,,,,NA,NA,1,,LIGO,Gravitation and Cosmology,2011,0,0,0,0,0,0,0,0,0,0,0,0,0,0,0,0,0,0,0,0,0,0,0,0,1,0,0,0,0,0
334,1404672,All-sky search for long-duration gravitational wave transients with initial LIGO,published;hep;core;citeable;arxiv,Phys.Rev.,,,,,,PHYSICAL REVIEW D,14759,29,LIGO Scientific;VIRGO,LIGO;VIRGO,gr-qc;Gravitation and Cosmology;astro-ph.CO;Astrophysics;astro-ph.IM;Instrumentation,2016,0,0,0,0,0,0,0,0,0,0,0,0,0,0,0,0,0,0,0,0,0,0,0,0,0,8,10,4,5,1
335,1404808,FScan Code Development for Advanced LIGO Detector Characterization,hep;thesis;core,NA,,,,,,NA,NA,,,LIGO;AdvLIGO,Gravitation and Cosmology,2015,0,0,0,0,0,0,0,0,0,0,0,0,0,0,0,0,0,0,0,0,0,0,0,0,0,0,0,0,0,0
336,1411881,Analytical Model for Ring Heater Thermal Compensation in Advanced LIGO,hep;core;citeable,Appl.Opt.,,,,,"Applied Optics Vol. 55, No. 10, pp. 2619-2625 (2016)",,,6,,AdvLIGO,Instrumentation;astro-ph.IM;physics.ins-det,2015,0,0,0,0,0,0,0,0,0,0,0,0,0,0,0,0,0,0,0,0,0,0,0,0,0,1,2,2,1,0
337,1412981,Searches for coincident High Energy Neutrinos and Gravitational Wave Bursts using the ANTARES and VIRGO/LIGO detectors,hep;core;conferencepaper,NA,1410695,,,,,NA,NA,,ANTARES;LIGO SCIENTIFIC;VIRGO,ANTARES;LIGO;VIRGO,Astrophysics,2013,0,0,0,0,0,0,0,0,0,0,0,0,0,0,0,0,0,0,0,0,0,0,0,0,0,0,0,0,0,0
338,1415240,Optimizing spinning time-domain gravitational waveforms for Advanced LIGO data analysis,published;hep;core;citeable;arxiv,Class.Quant.Grav.,,,,,,CLASSICAL AND QUANTUM GRAVITY,3723,12,,LIGO,astro-ph.HE;Astrophysics;gr-qc;Gravitation and Cosmology,2016,0,0,0,0,0,0,0,0,0,0,0,0,0,0,0,0,0,0,0,0,0,0,0,0,0,1,4,2,2,3
339,1416440,The Advanced LIGO Input Optics,hep;core;citeable;published,Rev.Sci.Instrum.,,,,,,REVIEW OF SCIENTIFIC INSTRUMENTS,16701,21,aLIGO,AdvLIGO,Instrumentation;physics.ins-det;astro-ph.IM,2016,0,0,0,0,0,0,0,0,0,0,0,0,0,0,0,0,0,0,0,0,0,0,0,0,0,6,2,2,3,8
340,1419481,Analysis of data from interferometric gravitational-wave detectors,hep;core;conferencepaper;citeable,Proc.SPIE Int.Soc.Opt.Eng.,1419130,,,,,,,,LIGO Scientific,LIGO,Instrumentation,2003,0,0,0,0,0,0,0,0,0,0,0,0,0,0,0,0,0,0,0,0,0,0,0,0,0,0,0,0,0,0
341,1419487,Status of LIGO,hep;core;conferencepaper;citeable,Proc.SPIE Int.Soc.Opt.Eng.,1419130,,,,,,,,,LIGO,Instrumentation,2003,0,0,0,0,0,0,0,0,0,0,0,0,0,0,0,0,0,0,0,0,0,0,0,0,0,0,0,0,0,0
342,1419493,Overview of LIGO instrumentation,hep;core;conferencepaper;citeable,Proc.SPIE Int.Soc.Opt.Eng.,1419131,,,,,,,9,LIGO Scientific,LIGO,Instrumentation,2004,0,0,0,0,0,0,0,0,0,0,0,0,0,0,0,0,0,0,0,0,1,0,0,4,1,3,0,0,0,0
343,1419496,Gravitoastronomy with neutron stars,hep;conferencepaper;citeable,Proc.SPIE Int.Soc.Opt.Eng.,1419131,,,,,,,,LIGO Scientific,LIGO,Instrumentation,2004,0,0,0,0,0,0,0,0,0,0,0,0,0,0,0,0,0,0,0,0,0,0,0,0,0,0,0,0,0,0
344,1419499,Seismic isolation and suspension systems for Advanced LIGO,hep;core;conferencepaper;citeable,Proc.SPIE Int.Soc.Opt.Eng.,1419131,,,,,,,8,,LIGO,Instrumentation,2004,0,0,0,0,0,0,0,0,0,0,0,0,0,0,0,1,0,0,1,1,1,2,0,1,0,0,0,0,0,0
345,1419695,Modeling and Experiment of the Suspended Seismometer Concept for Attenuating the Contribution of Tilt Motion in Horizontal Measurements,published;hep;core;citeable;arxiv,Rev.Sci.Instrum.,,,,,,REVIEW OF SCIENTIFIC INSTRUMENTS,16701,5,,LIGO,physics.ins-det;Instrumentation,2016,0,0,0,0,0,0,0,0,0,0,0,0,0,0,0,0,0,0,0,0,0,0,0,0,0,0,0,1,4,0
346,1419811,The Laser Interferometer Gravitational-Wave Observatory LIGO,hep;core;conferencepaper;citeable,Adv.Space Res.,1419731,,,,,,,7,,LIGO,Instrumentation;Gravitation and Cosmology,2000,0,0,0,0,0,0,0,0,0,1,0,0,0,3,0,1,1,0,0,1,0,0,0,0,0,0,0,0,0,0
347,1421100,Observation of Gravitational Waves from a Binary Black Hole Merger,published;hep;core;citeable;data;arxiv,Phys.Rev.Lett.,,,,,,PHYSICAL REVIEW LETTERS,14761,6099,LIGO Scientific;Virgo,LIGO;VIRGO,Gravitation and Cosmology,2016,0,0,0,0,0,0,0,0,0,0,0,0,0,0,0,1,0,0,0,0,0,0,0,2,6,718,1266,1242,1255,1470
348,1421133,GW150914: The Advanced LIGO Detectors in the Era of First Discoveries,published;hep;core;citeable;arxiv,Phys.Rev.Lett.,,,,,,PHYSICAL REVIEW LETTERS,14761,347,LIGO Scientific;Virgo,LIGO;VIRGO,gr-qc;Gravitation and Cosmology;astro-ph.HE;Astrophysics;astro-ph.IM;Instrumentation,2016,0,0,0,0,0,0,0,0,0,0,0,0,0,0,0,0,0,0,0,0,0,0,1,0,0,47,91,79,59,67
