,ID,Title,Type,Venue Name,Venue ID,Venue ISBN,Venue Acronym,Venue Presented At,Venue Extra,Venue Map Name,Venue Map ID,Citations,Collaborations,Experiments,Classification,Year,Citations 1991,Citations 1992,Citations 1993,Citations 1994,Citations 1995,Citations 1996,Citations 1997,Citations 1998,Citations 1999,Citations 2000,Citations 2001,Citations 2002,Citations 2003,Citations 2004,Citations 2005,Citations 2006,Citations 2007,Citations 2008,Citations 2009,Citations 2010,Citations 2011,Citations 2012,Citations 2013,Citations 2014,Citations 2015,Citations 2016,Citations 2017,Citations 2018,Citations 2019,Citations 2020
0,35071,"The Sensitivity of the laser interferometer gravitational wave observatory (LIGO) to a stochastic background, and its dependence on the detector orientations",published;hep;core;citeable;arxiv,Phys.Rev.,,,,,,PHYSICAL REVIEW D,14759,226,,LIGO,Astrophysics,1993,0,0,1,1,2,10,8,5,9,8,11,10,5,4,11,4,7,11,12,4,9,3,7,11,9,9,5,8,10,23
1,305123,Thermal noise in mechanical experiments,published;core;citeable;hep,Phys.Rev.,,,,,,PHYSICAL REVIEW D,14759,325,,LIGO,Gravitation and Cosmology;General Physics,1990,0,1,5,5,7,9,10,11,15,13,8,15,10,11,6,9,3,10,8,7,9,10,6,11,18,14,7,19,13,29
2,348147,LIGO: The Laser interferometer gravitational wave observatory,published;citeable;introductory;hep,Science,,,,,,SCIENCE,17311,1240,,LIGO,,1992,1,7,34,38,50,65,60,57,74,55,53,64,66,51,45,40,56,45,35,37,30,30,22,27,30,30,19,22,19,24
3,351030,The LIGO project,hep;core;conferencepaper,NA,369945,,,Prepared for,,NA,NA,,,LIGO,,1992,0,0,0,0,0,0,0,0,0,0,0,0,0,0,0,0,0,0,0,0,0,0,0,0,0,0,0,0,0,0
4,353819,The Ligo / Virgo gravitational wave detection system,hep;core;conferencepaper,NA,,,,Prepared for 4th Rencontres de Blois: Particle Astrophysics,"#DONE:In *Blois 1992, Particle astrophysics* 375-390",NA,NA,,,LIGO,Instrumentation,1993,0,0,0,0,0,0,0,0,0,0,0,0,0,0,0,0,0,0,0,0,0,0,0,0,0,0,0,0,0,0
5,362797,Thermal noise in the test mass suspensions of a laser interferometer gravitational wave detector prototype,published;core;citeable;hep,Phys.Lett.,,,,,,PHYSICS LETTERS B,14781,34,,LIGO,,1993,0,0,0,2,2,3,2,1,3,4,1,2,0,1,0,1,0,1,0,1,0,0,0,1,0,1,2,1,0,1
6,363712,Observing binary inspiral with LIGO,conferencepaper;hep;core;citeable;arxiv,NA,,,,To be published in the proceedings of,,NA,NA,1,,LIGO,Gravitation and Cosmology,1993,0,0,0,0,0,0,0,0,0,0,0,0,0,0,0,0,0,1,0,0,0,0,0,0,0,0,0,0,0,0
7,365506,Experiment for gravitational wave detection and the LIGO project,hep;core;conferencepaper,NA,,,,,"In *Tokyo 1993, Proceedings, General relativity and gravitation* 339-350",NA,NA,,,LIGO,,1993,0,0,0,0,0,0,0,0,0,0,0,0,0,0,0,0,0,0,0,0,0,0,0,0,0,0,0,0,0,0
8,372555,"LIGO, VIRGO, and the International network of laser interferometer gravitational wave detectors",hep;core;conferencepaper,NA,390910,,,,,NA,NA,1,,LIGO,Instrumentation;Gravitation and Cosmology,1994,0,0,0,1,0,0,0,0,0,0,0,0,0,0,0,0,0,0,0,0,0,0,0,0,0,0,0,0,0,0
9,384167,Suspension losses in the pendula of laser interferometer gravitational wave detectors,published;core;citeable;hep,Phys.Lett.,,,,,,PHYSICS LETTERS B,14781,28,,LIGO,,1994,0,0,0,1,2,4,1,2,5,2,0,0,2,1,1,0,1,0,0,0,0,0,0,0,0,1,0,1,0,1
10,386500,The LIGO project: Progress and prospects,hep;core;conferencepaper,NA,408130,,,Given at,,NA,NA,,,LIGO,,1994,0,0,0,0,0,0,0,0,0,0,0,0,0,0,0,0,0,0,0,0,0,0,0,0,0,0,0,0,0,0
11,386534,The Laser Interferometer Gravitational-wave Observatory (LIGO) project: A Status report,hep;core;conferencepaper,NA,403412,,,Given at,,NA,NA,,,LIGO,,1994,0,0,0,0,0,0,0,0,0,0,0,0,0,0,0,0,0,0,0,0,0,0,0,0,0,0,0,0,0,0
12,392622,"Binary neutron star inspiral, LIGO, and cosmology",conferencepaper;hep;core;citeable;arxiv,NA,408951,,,Prepared for,,NA,NA,1,,LIGO,Gravitation and Cosmology,1995,0,0,0,0,0,0,0,0,1,0,0,0,0,0,0,0,0,0,0,0,0,0,0,0,0,0,0,0,0,0
13,404589,Gravitational waves,conferencepaper;hep;core;review;citeable;arxiv,NA,408412,,,Presented at,Snowmass Summer Study 1994:0160-184,NA,NA,56,,LIGO,Gravitation and Cosmology,1995,0,0,0,0,2,4,4,5,1,5,6,7,3,1,2,1,2,2,1,0,0,1,0,1,0,0,0,1,0,0
14,405747,Thermally excited vibrations of the mirrors of laser interferometer gravitational wave detectors,published;core;citeable;hep,Phys.Rev.,,,,,,PHYSICAL REVIEW D,14759,75,,LIGO,Experiment-HEP,1995,0,0,0,1,2,5,1,3,8,5,5,4,5,2,2,1,1,3,1,4,3,1,2,2,0,2,0,1,0,1
15,415710,The LIGO research community: Defining a research environment,hep;citeable;arxiv,NA,,,,,,NA,NA,,,LIGO,Gravitation and Cosmology,1996,0,0,0,0,0,0,0,0,0,0,0,0,0,0,0,0,0,0,0,0,0,0,0,0,0,0,0,0,0,0
16,423015,Detecting relic gravitational radiation from string cosmology with LIGO,published;hep;core;citeable;arxiv,Phys.Rev.,,,,,,PHYSICAL REVIEW D,14759,46,,LIGO,Gravitation and Cosmology,1996,0,0,0,0,1,1,11,7,7,4,3,3,0,1,2,1,1,1,0,0,0,0,0,0,0,0,0,0,2,0
17,424115,First LIGO events: Binary black holes mergings,hep;citeable;arxiv,New Astron.,,,,,,NEW ASTRONOMY,13676,49,,LIGO,Astrophysics,1996,0,0,0,0,0,0,5,2,3,6,2,5,2,4,1,2,1,0,0,0,0,0,0,0,0,2,5,4,2,1
18,429529,Improved sensitivity in a gravitational wave interferometer and implications for LIGO,published;core;citeable;hep,Phys.Lett.,,,,,,PHYSICS LETTERS B,14781,89,,LIGO,,1996,0,0,0,0,0,0,3,5,12,11,11,11,3,4,1,1,4,3,0,0,1,1,1,0,1,3,1,3,5,1
19,433062,The status of LIGO,hep;core;conferencepaper;citeable,AIP Conf.Proc.,535669,,,,,AIP CONFERENCE PROCEEDINGS,907,,,LIGO,Instrumentation,2000,0,0,0,0,0,0,0,0,0,0,0,0,0,0,0,0,0,0,0,0,0,0,0,0,0,0,0,0,0,0
20,435486,LIGO: Status and prospects,hep;core;conferencepaper,NA,487291,,,,"In *Sao Jose dos Campos 1996, Omnidirectional Gravitational Radiation Observatory* 260-266",NA,NA,,,LIGO,Instrumentation,1996,0,0,0,0,0,0,0,0,0,0,0,0,0,0,0,0,0,0,0,0,0,0,0,0,0,0,0,0,0,0
21,435505,LIGO project: An overview,hep;core;conferencepaper,NA,429717,,,,,NA,NA,,,LIGO,Gravitation and Cosmology,1996,0,0,0,0,0,0,0,0,0,0,0,0,0,0,0,0,0,0,0,0,0,0,0,0,0,0,0,0,0,0
22,440715,Searching for periodic sources with LIGO,published;hep;core;citeable;arxiv,Phys.Rev.,,,,,,PHYSICAL REVIEW D,14759,185,,LIGO,Gravitation and Cosmology,1997,0,0,0,0,0,0,2,9,6,12,5,10,11,4,13,7,10,8,7,7,10,6,5,6,5,5,7,11,9,3
23,445234,Internal thermal noise in the LIGO test masses: A Direct approach,published;hep;core;citeable;arxiv,Phys.Rev.,,,,,,PHYSICAL REVIEW D,14759,247,,LIGO,Gravitation and Cosmology,1997,0,0,0,0,0,0,0,3,4,6,7,11,11,12,4,18,6,8,7,10,11,8,9,10,13,11,10,24,13,13
24,445903,Modeling LIGO data analysis,hep;core;conferencepaper,NA,479493,,,Talk given at,,NA,NA,,,LIGO,Instrumentation,1997,0,0,0,0,0,0,0,0,0,0,0,0,0,0,0,0,0,0,0,0,0,0,0,0,0,0,0,0,0,0
25,451956,Can LIGO see compact binaries?,conferencepaper;hep;core;citeable;arxiv,NA,,,,To be published in the proceedings of,,NA,NA,1,,LIGO,Gravitation and Cosmology,1997,0,0,0,0,0,0,0,0,1,0,0,0,0,0,0,0,0,0,0,0,0,0,0,0,0,0,0,0,0,0
26,458805,The LIGO project: Progress and plans,hep;core;conferencepaper,NA,486941,,,Prepared for,,NA,NA,,,LIGO,Instrumentation,1997,0,0,0,0,0,0,0,0,0,0,0,0,0,0,0,0,0,0,0,0,0,0,0,0,0,0,0,0,0,0
27,458831,Automatic alignment in a LIGO prototype interferometer,hep;core;conferencepaper,NA,486941,,,Prepared for,,NA,NA,,,LIGO,Instrumentation,1997,0,0,0,0,0,0,0,0,0,0,0,0,0,0,0,0,0,0,0,0,0,0,0,0,0,0,0,0,0,0
28,470060,High power interferometric phase measurement limited by quantum noise and application to detection of gravitational waves,published;core;citeable;hep,Phys.Rev.Lett.,,,,,,PHYSICAL REVIEW LETTERS,14761,19,,LIGO,Instrumentation,1998,0,0,0,0,0,0,0,0,0,3,6,2,0,0,0,0,0,0,2,0,1,0,0,1,1,0,0,2,0,0
29,470294,How to reduce the suspension thermal noise in LIGO without improving the Q's of the pendulum and violin modes,published;hep;core;citeable;arxiv,Measur.Sci.Tech.,,,,,,,,22,,LIGO,Gravitation and Cosmology,1998,0,0,0,0,0,0,0,0,1,6,2,1,0,0,1,1,0,0,1,1,1,1,0,0,0,1,1,4,0,0
30,480521,Searching for periodic sources with LIGO. 2. Hierarchical searches,published;hep;core;citeable;arxiv,Phys.Rev.,,,,,,PHYSICAL REVIEW D,14759,192,,LIGO,Gravitation and Cosmology,1998,0,0,0,0,0,0,0,0,8,12,10,8,6,6,11,7,5,8,2,7,12,6,9,8,9,13,5,12,10,8
31,485621,The detection of gravitational waves: LIGO,hep;core;conferencepaper,NA,509247,,,Prepared for,,NA,NA,,,LIGO,,1998,0,0,0,0,0,0,0,0,0,0,0,0,0,0,0,0,0,0,0,0,0,0,0,0,0,0,0,0,0,0
32,499566,The Detection of gravitational waves with LIGO,conferencepaper;hep;core;citeable;arxiv,NA,1668127,,,Talk given at,,NA,NA,6,,LIGO,Gravitation and Cosmology,1999,0,0,0,0,0,0,0,0,2,2,0,0,0,1,1,0,0,0,0,0,0,0,0,0,0,0,0,0,0,0
33,506844,Notes on anelastic effects and thermal noise in suspensions of test masses in interferometric gravitational wave detectors,hep;core;citeable;arxiv,NA,,,,,,NA,NA,1,,LIGO,Instrumentation,1999,0,0,0,0,0,0,0,0,0,0,0,0,0,0,0,0,0,0,0,0,0,0,1,0,0,0,0,0,0,0
34,506845,Optimization of thermal noise in multiloop pendulum suspensions for use in interferometric gravitational wave detectors,hep;core;citeable;arxiv,NA,,,,,,NA,NA,,,LIGO,Instrumentation,1999,0,0,0,0,0,0,0,0,0,0,0,0,0,0,0,0,0,0,0,0,0,0,0,0,0,0,0,0,0,0
35,516049,Signal extraction and length sensing for LIGO II RSE,hep;core;conferencepaper;citeable,AIP Conf.Proc.,535669,,,Prepared for,,AIP CONFERENCE PROCEEDINGS,907,,,LIGO,,2000,0,0,0,0,0,0,0,0,0,0,0,0,0,0,0,0,0,0,0,0,0,0,0,0,0,0,0,0,0,0
36,516059,Active seismic isolation for enhanced LIGO detectors,hep;core;conferencepaper;citeable,AIP Conf.Proc.,535669,,,Prepared for,,AIP CONFERENCE PROCEEDINGS,907,1,,LIGO,,2000,0,0,0,0,0,0,0,0,0,0,0,0,0,1,0,0,0,0,0,0,0,0,0,0,0,0,0,0,0,0
37,516062,New Seismic Attenuation System (SAS) for the advanced LIGO configurations (LIGO2),hep;core;conferencepaper;citeable,AIP Conf.Proc.,535669,,,Prepared for,,AIP CONFERENCE PROCEEDINGS,907,2,,LIGO,,2000,0,0,0,0,0,0,0,0,0,0,0,0,0,0,0,0,0,0,0,0,0,0,1,0,0,0,0,0,0,1
38,516098,LIGO end-to-end simulation program,hep;core;conferencepaper;citeable,AIP Conf.Proc.,535669,,,Prepared for,,AIP CONFERENCE PROCEEDINGS,907,,,LIGO,,2000,0,0,0,0,0,0,0,0,0,0,0,0,0,0,0,0,0,0,0,0,0,0,0,0,0,0,0,0,0,0
39,528725,Suspensions thermal noise in LIGO gravitational wave detector,published;hep;core;citeable;arxiv,Class.Quant.Grav.,,,,,,CLASSICAL AND QUANTUM GRAVITY,3723,28,,LIGO,Gravitation and Cosmology,2000,0,0,0,0,0,0,0,0,0,1,0,0,0,0,1,1,1,0,0,0,0,1,3,0,3,1,2,2,4,4
40,530499,Tumbleweeds and airborne gravitational noise sources for LIGO,published;hep;core;citeable;arxiv,Class.Quant.Grav.,,,,,,CLASSICAL AND QUANTUM GRAVITY,3723,41,,LIGO,Gravitation and Cosmology,2000,0,0,0,0,0,0,0,0,0,0,1,2,0,0,1,0,1,0,3,2,1,0,2,2,4,3,3,6,4,6
41,541846,LIGO: Status and plans,conferencepaper;hep;core;lectures;citeable,ICTP Lect.Notes Ser.,561654,,,Prepared for,,,,,,LIGO,Instrumentation,2000,0,0,0,0,0,0,0,0,0,0,0,0,0,0,0,0,0,0,0,0,0,0,0,0,0,0,0,0,0,0
42,542498,The second generation LIGO interferometers,hep;core;conferencepaper,AIP Conf.Proc.,566672,,,Prepared for,,AIP CONFERENCE PROCEEDINGS,907,1,,LIGO,Instrumentation,2001,0,0,0,0,0,0,0,0,0,0,0,0,0,0,0,1,0,0,0,0,0,0,0,0,0,0,0,0,0,0
43,542502,Data from the LIGO I science run,hep;core;conferencepaper,AIP Conf.Proc.,566672,,,Prepared for,,AIP CONFERENCE PROCEEDINGS,907,,,LIGO,Instrumentation,2001,0,0,0,0,0,0,0,0,0,0,0,0,0,0,0,0,0,0,0,0,0,0,0,0,0,0,0,0,0,0
44,542503,Gravitational wave data analysis in the LIGO scientific collaboration,hep;core;conferencepaper,AIP Conf.Proc.,566672,,,Prepared for,,AIP CONFERENCE PROCEEDINGS,907,,,LIGO,Instrumentation,2001,0,0,0,0,0,0,0,0,0,0,0,0,0,0,0,0,0,0,0,0,0,0,0,0,0,0,0,0,0,0
45,552594,Eliminating thermal violin spikes from LIGO noise,published;hep;core;citeable;arxiv,Phys.Rev.,,,,,,PHYSICAL REVIEW D,14759,10,,LIGO,Gravitation and Cosmology,2001,0,0,0,0,0,0,0,0,0,0,1,1,0,1,0,1,0,0,0,0,0,0,0,0,0,0,1,0,1,1
46,555467,"LIGO's ""science reach""",conferencepaper;hep;core;citeable;arxiv,AIP Conf.Proc.,566672,,,,,AIP CONFERENCE PROCEEDINGS,907,8,,LIGO,Gravitation and Cosmology,2001,0,0,0,0,0,0,0,0,0,0,0,3,3,0,0,0,1,0,0,1,0,0,0,0,0,0,0,0,0,0
47,556226,Comparison of advanced gravitational wave detectors,published;hep;core;citeable;arxiv,Phys.Rev.,,,,,,PHYSICAL REVIEW D,14759,14,,LIGO,Gravitation and Cosmology,2001,0,0,0,0,0,0,0,0,0,0,0,2,0,0,3,4,3,2,0,0,0,0,0,0,0,0,0,0,0,0
48,564941,The LIGO suspended optic digital control system,conferencepaper;hep;core;citeable;arxiv,eConf,,,,,,,,2,,LIGO,General Physics,2001,0,0,0,0,0,0,0,0,0,0,1,0,1,0,0,0,0,0,0,0,0,0,0,0,0,0,0,0,0,0
49,565783,The status of LIGO installation and commissioning,published;conferencepaper;hep;core;citeable,Class.Quant.Grav.,,,,,,CLASSICAL AND QUANTUM GRAVITY,3723,,,LIGO,Instrumentation,2001,0,0,0,0,0,0,0,0,0,0,0,0,0,0,0,0,0,0,0,0,0,0,0,0,0,0,0,0,0,0
50,572612,Development of large size sapphire crystals for Laser Interferometer Gravitational Wave Observatory,hep;core;conferencepaper;citeable,eConf,,,,,,,,,,LIGO,Instrumentation,2001,0,0,0,0,0,0,0,0,0,0,0,0,0,0,0,0,0,0,0,0,0,0,0,0,0,0,0,0,0,0
51,587424,Commissioning of the LIGO detectors,published;conferencepaper;hep;core;citeable,Class.Quant.Grav.,,,,,,CLASSICAL AND QUANTUM GRAVITY,3723,32,,LIGO,,2002,0,0,0,0,0,0,0,0,0,0,1,4,7,6,3,4,0,1,0,1,0,0,0,0,0,0,0,0,0,0
52,587439,Advanced LIGO optical configuration and prototyping effort,published;conferencepaper;hep;core;citeable,Class.Quant.Grav.,,,,,,CLASSICAL AND QUANTUM GRAVITY,3723,27,,LIGO,,2002,0,0,0,0,0,0,0,0,0,0,0,0,2,3,1,2,1,5,1,3,1,2,0,0,0,0,2,0,2,1
53,587441,Seismic isolation for Advanced LIGO,published;conferencepaper;hep;core;citeable,Class.Quant.Grav.,,,,,,CLASSICAL AND QUANTUM GRAVITY,3723,52,,LIGO,,2002,0,0,0,0,0,0,0,0,0,0,0,3,5,2,1,3,1,0,0,2,3,7,3,5,4,1,3,2,1,1
54,593814,Quadruple suspension design for Advanced LIGO,published;core;citeable;hep,Class.Quant.Grav.,,,,,,CLASSICAL AND QUANTUM GRAVITY,3723,60,,LIGO,,2002,0,0,0,0,0,0,0,0,0,0,0,0,4,1,2,3,1,0,4,3,4,6,2,6,1,4,3,3,2,5
55,616110,Gravitational wave detectors: A Report from LIGO land,hep;core;conferencepaper;citeable,NA,634571,,,,,NA,NA,4,LIGO Scientific,LIGO,Gravitation and Cosmology;gr-qc,2003,0,0,0,0,0,0,0,0,0,0,0,0,3,0,0,0,1,0,0,0,0,0,0,0,0,0,0,0,0,0
56,621892,First results on gravity waves,hep;core;citeable;introductory,New Sci.,,,,,,NEW SCIENTIST,13716,,,LIGO,Gravitation and Cosmology,2003,0,0,0,0,0,0,0,0,0,0,0,0,0,0,0,0,0,0,0,0,0,0,0,0,0,0,0,0,0,0
57,624334,LIGO data analysis,published;conferencepaper;hep;core;citeable,Nucl.Instrum.Meth.,,,,,,NUCLEAR INSTRUMENTS & METHODS IN PHYSICS RESEARCH SECTION A-ACCELERATORS SPECTROMETERS DETECTORS AND ASSOCIATED EQUIPMENT,13913,,LIGO Scientific,LIGO,Computing;Instrumentation,2003,0,0,0,0,0,0,0,0,0,0,0,0,0,0,0,0,0,0,0,0,0,0,0,0,0,0,0,0,0,0
58,625917,Detector description and performance for the first coincidence observations between LIGO and GEO,published;hep;core;fermilab;citeable;arxiv,Nucl.Instrum.Meth.,,,,,,NUCLEAR INSTRUMENTS & METHODS IN PHYSICS RESEARCH SECTION A-ACCELERATORS SPECTROMETERS DETECTORS AND ASSOCIATED EQUIPMENT,13913,231,LIGO Scientific,LIGO,Instrumentation,2003,0,0,0,0,0,0,0,0,0,0,0,0,11,30,28,23,28,19,15,16,5,5,11,5,4,2,3,3,1,3
59,625985,Setting upper limits on the strength of periodic gravitational waves using the first science data from the GEO 600 and LIGO detectors,published;hep;core;fermilab;citeable;arxiv,Phys.Rev.,,,,,,PHYSICAL REVIEW D,14759,180,LIGO Scientific,LIGO,Gravitation and Cosmology,2003,0,0,0,0,0,0,0,0,0,0,0,0,4,23,26,8,7,14,8,7,8,6,6,10,5,7,8,5,10,3
60,626312,Analysis of LIGO data for gravitational waves from binary neutron stars,published;hep;core;fermilab;citeable;arxiv,Phys.Rev.,,,,,,PHYSICAL REVIEW D,14759,151,LIGO Scientific,LIGO,Gravitation and Cosmology,2003,0,0,0,0,0,0,0,0,0,0,0,0,7,23,28,10,12,7,14,8,3,3,7,4,1,5,1,0,1,3
61,627679,Status of the search for gravitational wave bursts with the LIGO detectors,published;conferencepaper;hep;core;citeable,Class.Quant.Grav.,,,,,,CLASSICAL AND QUANTUM GRAVITY,3723,4,LIGO Scientific,LIGO,Instrumentation,2003,0,0,0,0,0,0,0,0,0,0,0,0,0,2,1,0,0,1,0,0,0,0,0,0,0,0,0,0,0,0
62,627692,Advanced LIGO: Sources and astrophysics,published;conferencepaper;hep;core;citeable,Class.Quant.Grav.,,,,,,CLASSICAL AND QUANTUM GRAVITY,3723,8,,LIGO,Astrophysics,2003,0,0,0,0,0,0,0,0,0,0,0,0,0,0,0,0,2,2,1,0,0,0,0,0,0,0,3,0,0,0
63,627696,Calibration of the LIGO detectors for the first LIGO science run,published;conferencepaper;hep;core;citeable,Class.Quant.Grav.,,,,,,CLASSICAL AND QUANTUM GRAVITY,3723,13,LIGO Scientific,LIGO,Instrumentation,2003,0,0,0,0,0,0,0,0,0,0,0,0,3,3,3,0,0,0,2,0,0,0,0,0,0,0,0,0,0,0
64,630097,Search for inspiralling neutron stars in LIGO S1 data,hep;core;conferencepaper;citeable,Class.Quant.Grav.,650097,,,,Class.Quant.Grav. 21 (2004) S691-S696,CLASSICAL AND QUANTUM GRAVITY,3723,3,LIGO Scientific,LIGO,Astrophysics;Instrumentation;gr-qc,2003,0,0,0,0,0,0,0,0,0,0,0,0,1,0,1,1,0,0,0,0,0,0,0,0,0,0,0,0,0,0
65,632730,Upper limits on the strength of periodic gravitational waves from PSR J1939+2134,published;conferencepaper;hep;core;fermilab;citeable;arxiv,Class.Quant.Grav.,,,,,,CLASSICAL AND QUANTUM GRAVITY,3723,3,LIGO Scientific,LIGO,Gravitation and Cosmology,2003,0,0,0,0,0,0,0,0,0,0,0,0,0,2,0,0,1,0,0,0,0,0,0,0,0,0,0,0,0,0
66,634642,Testing the LIGO inspiral analysis with hardware injections,published;conferencepaper;hep;core;citeable,Class.Quant.Grav.,,,,,Class.Quant.Grav. 21 (2004) S797-S800,CLASSICAL AND QUANTUM GRAVITY,3723,11,LIGO Scientific,LIGO,Instrumentation;gr-qc,2003,0,0,0,0,0,0,0,0,0,0,0,0,0,0,1,1,1,0,0,0,1,1,1,0,1,2,0,1,0,0
67,635055,First upper limits from LIGO on gravitational wave bursts,published;conferencepaper;hep;core;fermilab;citeable,Class.Quant.Grav.,650097,,,,,CLASSICAL AND QUANTUM GRAVITY,3723,1,LIGO Scientific,LIGO,Gravitation and Cosmology,2003,0,0,0,0,0,0,0,0,0,0,0,0,0,0,0,0,0,0,0,0,0,0,0,0,0,0,0,0,0,0
68,636029,Analysis of first LIGO science data for stochastic gravitational waves,published;hep;core;fermilab;citeable;arxiv,Phys.Rev.,,,,,,PHYSICAL REVIEW D,14759,98,LIGO Scientific,LIGO,Gravitation and Cosmology;Instrumentation,2003,0,0,0,0,0,0,0,0,0,0,0,0,3,13,24,5,5,8,3,2,3,2,2,1,5,1,3,4,0,3
69,637128,LIGO detectors and data analyses: Current status and future prospects,hep;core;conferencepaper,NA,632683,,,Prepared for,,NA,NA,,LIGO Scientific,LIGO,Instrumentation,2003,0,0,0,0,0,0,0,0,0,0,0,0,0,0,0,0,0,0,0,0,0,0,0,0,0,0,0,0,0,0
70,639405,Searching for gravitational waves from binary inspirals with LIGO,published;conferencepaper;hep;review;citeable;arxiv,Class.Quant.Grav.,,,,,,CLASSICAL AND QUANTUM GRAVITY,3723,20,,LIGO,Gravitation and Cosmology,2003,0,0,0,0,0,0,0,0,0,0,0,0,0,0,1,0,3,1,3,1,2,1,2,0,2,2,1,0,0,0
71,639462,Mirror thermal noise in interferometric gravitational wave detectors,hep;thesis;core,NA,,,,,,NA,NA,,,LIGO,Instrumentation,2003,0,0,0,0,0,0,0,0,0,0,0,0,0,0,0,0,0,0,0,0,0,0,0,0,0,0,0,0,0,0
72,639465,Topics of LIGO physics: Quantum noise in advanced interferometers and template banks for compact-binary inspirals,hep;thesis;core,NA,,,,,,NA,NA,,,LIGO,Gravitation and Cosmology;Instrumentation,2003,0,0,0,0,0,0,0,0,0,0,0,0,0,0,0,0,0,0,0,0,0,0,0,0,0,0,0,0,0,0
73,640068,Status of LIGO interferometers,hep;conferencepaper,NA,672206,,,Prepared for,,NA,NA,,,LIGO,Gravitation and Cosmology;Instrumentation,2003,0,0,0,0,0,0,0,0,0,0,0,0,0,0,0,0,0,0,0,0,0,0,0,0,0,0,0,0,0,0
74,640318,The LIGO gravitational wave obervatories: Recent results and future plans,hep;conferencepaper,NA,705371,,,Prepared for,,NA,NA,1,LIGO Scientific,LIGO,Gravitation and Cosmology;Instrumentation,2003,0,0,0,0,0,0,0,0,0,0,0,0,0,0,0,0,0,0,0,0,0,0,0,1,0,0,0,0,0,0
75,647281,Vetoes for inspiral triggers in LIGO data,published;conferencepaper;hep;core;citeable,Class.Quant.Grav.,,,,,Class.Quant.Grav. 21 (2004) S1747-S1756,CLASSICAL AND QUANTUM GRAVITY,3723,19,LIGO Scientific,LIGO,Gravitation and Cosmology;Instrumentation;gr-qc,2004,0,0,0,0,0,0,0,0,0,0,0,0,0,1,4,2,0,2,0,4,0,0,1,0,1,0,1,0,0,2
76,648107,Proposal for lower frequency companions for the advanced LIGO gravitational wave interferometric detectors,published;conferencepaper;hep;core;citeable,Nucl.Instrum.Meth.,,,,,,NUCLEAR INSTRUMENTS & METHODS IN PHYSICS RESEARCH SECTION A-ACCELERATORS SPECTROMETERS DETECTORS AND ASSOCIATED EQUIPMENT,13913,4,,LIGO,Instrumentation,2004,0,0,0,0,0,0,0,0,0,0,0,0,0,0,1,0,0,0,1,1,0,0,0,0,0,0,1,0,0,0
77,648304,Commissioning of LIGO detectors,published;conferencepaper;hep;core;citeable,Class.Quant.Grav.,,,,,,CLASSICAL AND QUANTUM GRAVITY,3723,39,,LIGO,Instrumentation,2004,0,0,0,0,0,0,0,0,0,0,0,0,0,7,9,11,4,4,1,0,0,0,0,0,0,1,0,0,0,0
78,648313,LIGO laser intensity noise suppression,published;conferencepaper;hep;core;citeable,Class.Quant.Grav.,,,,,,CLASSICAL AND QUANTUM GRAVITY,3723,5,,LIGO,Instrumentation,2004,0,0,0,0,0,0,0,0,0,0,0,0,0,0,1,1,0,0,0,1,0,0,0,1,0,0,0,0,0,0
79,648314,Characterization of the LIGO 4-km Fabry-Perot cavities via their high-frequency dynamic responses to length and laser frequency variations,published;conferencepaper;hep;core;citeable,Class.Quant.Grav.,,,,,,CLASSICAL AND QUANTUM GRAVITY,3723,7,,LIGO,Instrumentation,2004,0,0,0,0,0,0,0,0,0,0,0,0,0,0,0,0,1,0,1,0,0,0,0,0,2,0,1,0,0,1
80,648331,First upper limit analysis and results from LIGO science data: Stochastic background,published;conferencepaper;hep;core;citeable,Class.Quant.Grav.,,,,,Class.Quant.Grav. 21 (2004) S685-S690,CLASSICAL AND QUANTUM GRAVITY,3723,,LIGO Scientific,LIGO,Astrophysics;Gravitation and Cosmology;Instrumentation;gr-qc,2004,0,0,0,0,0,0,0,0,0,0,0,0,0,0,0,0,0,0,0,0,0,0,0,0,0,0,0,0,0,0
81,648341,Gamma ray bursts and gravitational waves: Triggered search strategy in the LIGO science runs,published;conferencepaper;hep;core;citeable,Class.Quant.Grav.,,,,,,CLASSICAL AND QUANTUM GRAVITY,3723,8,,LIGO,Instrumentation,2004,0,0,0,0,0,0,0,0,0,0,0,0,0,3,1,0,1,0,1,0,0,1,0,0,0,0,0,0,1,0
82,648355,Advanced LIGO: Non-Gaussian beams,published;conferencepaper;hep;core;citeable,Class.Quant.Grav.,,,,,,CLASSICAL AND QUANTUM GRAVITY,3723,7,,LIGO,Instrumentation,2004,0,0,0,0,0,0,0,0,0,0,0,0,0,0,0,1,0,0,0,1,1,0,0,0,0,0,1,0,1,0
83,648362,Seismic isolation enhancements for initial and advanced LIGO,published;conferencepaper;hep;core;citeable,Class.Quant.Grav.,,,,,,CLASSICAL AND QUANTUM GRAVITY,3723,30,,LIGO,Instrumentation,2004,0,0,0,0,0,0,0,0,0,0,0,0,0,0,0,2,1,0,0,3,0,5,2,5,2,0,1,1,1,1
84,648387,Study of the different responsive behaviour of the sidebands in LIGO I,published;conferencepaper;hep;core;citeable,Class.Quant.Grav.,,,,,,CLASSICAL AND QUANTUM GRAVITY,3723,3,,LIGO,Instrumentation,2004,0,0,0,0,0,0,0,0,0,0,0,0,0,0,0,0,1,0,0,0,0,0,1,0,0,0,0,0,0,0
85,648392,Lower frequency companions for the advanced LIGO gravitational wave interferometric detectors: An observational opportunity?,published;conferencepaper;hep;core;citeable,Class.Quant.Grav.,,,,,,CLASSICAL AND QUANTUM GRAVITY,3723,2,,LIGO,Instrumentation,2004,0,0,0,0,0,0,0,0,0,0,0,0,0,0,0,0,0,0,2,0,0,0,0,0,0,0,0,0,0,0
86,650083,First upper limits from ligo on gravitational wave bursts,published;hep;core;citeable;arxiv,Phys.Rev.,650097,,,,,PHYSICAL REVIEW D,14759,105,LIGO Scientific,LIGO,Astrophysics;Instrumentation,2004,0,0,0,0,0,0,0,0,0,0,0,0,1,20,25,6,8,8,8,2,1,3,4,1,2,3,1,0,0,2
87,660958,Limits on gravitational wave emission from selected pulsars using LIGO data,published;hep;core;citeable;arxiv,Phys.Rev.Lett.,,,,,,PHYSICAL REVIEW LETTERS,14761,134,LIGO Scientific,LIGO,Gravitation and Cosmology,2004,0,0,0,0,0,0,0,0,0,0,0,0,0,1,21,17,9,18,7,9,6,4,1,4,4,4,4,4,5,1
88,664125,Status of LIGO data analysis,published;conferencepaper;citeable;hep,Class.Quant.Grav.,,,,,,CLASSICAL AND QUANTUM GRAVITY,3723,2,LIGO Scientific,LIGO,Gravitation and Cosmology,2004,0,0,0,0,0,0,0,0,0,0,0,0,0,1,1,0,0,0,0,0,0,0,0,0,0,0,0,0,0,0
89,664136,Plans for the LIGO-TAMA joint search for gravitational wave bursts,published;conferencepaper;hep;citeable;arxiv,Class.Quant.Grav.,,,,,,CLASSICAL AND QUANTUM GRAVITY,3723,4,,LIGO;NEW-EXP;TAMA,Gravitation and Cosmology;Instrumentation,2004,0,0,0,0,0,0,0,0,0,0,0,0,0,2,2,0,0,0,0,0,0,0,0,0,0,0,0,0,0,0
90,664137,Multiresolution techniques for the detection of gravitational-wave bursts,published;conferencepaper;hep;citeable;arxiv,Class.Quant.Grav.,,,,,,CLASSICAL AND QUANTUM GRAVITY,3723,123,,LIGO,Gravitation and Cosmology,2004,0,0,0,0,0,0,0,0,0,0,0,0,0,0,6,4,4,4,10,9,2,4,5,6,4,13,15,7,5,17
91,666759,Gravitational wave detectors: New eyes for physics and astronomy,hep;core;conferencepaper;citeable,Pramana,,,,,,PRAMANA,15125,1,LIGO Scientific,LIGO,Gravitation and Cosmology;Instrumentation,2004,0,0,0,0,0,0,0,0,0,0,0,0,0,0,1,0,0,0,0,0,0,0,0,0,0,0,0,0,0,0
92,675442,A Search for gravitational waves associated with the gamma ray burst GRB030329 using the LIGO detectors,published;hep;core;fermilab;citeable;arxiv,Phys.Rev.,,,,,,PHYSICAL REVIEW D,14759,99,LIGO Scientific,LIGO,Gravitation and Cosmology,2005,0,0,0,0,0,0,0,0,0,0,0,0,0,0,13,10,10,15,10,5,9,5,6,1,0,3,0,1,1,1
93,680368,A First comparison between LIGO and Virgo inspiral search pipelines,published;conferencepaper;hep;citeable;arxiv,Class.Quant.Grav.,,,,,,CLASSICAL AND QUANTUM GRAVITY,3723,9,VIRGO Joint LIGO / Working Group,LIGO,Gravitation and Cosmology,2005,0,0,0,0,0,0,0,0,0,0,0,0,0,0,2,1,2,0,0,2,0,0,0,0,0,0,0,0,0,0
94,680547,Report on the first binary black hole inspiral search in LIGO data,hep;conferencepaper;citeable;published,Class.Quant.Grav.,,,,,Class.Quant.Grav. 22 (2005) S1119-S1128,CLASSICAL AND QUANTUM GRAVITY,3723,5,LIGO Scientific,LIGO,Gravitation and Cosmology;gr-qc,2005,0,0,0,0,0,0,0,0,0,0,0,0,0,0,1,0,1,0,0,0,0,0,1,1,0,0,0,0,0,0
95,680622,Veto studies for LIGO inspiral triggers,published;conferencepaper;hep;citeable;arxiv,Class.Quant.Grav.,,,,,,CLASSICAL AND QUANTUM GRAVITY,3723,16,LIGO Scientific,LIGO,Gravitation and Cosmology,2005,0,0,0,0,0,0,0,0,0,0,0,0,0,0,1,0,2,2,1,2,1,0,1,0,1,0,2,0,0,1
96,681066,Gravitational wave burst vetoes in the LIGO S2 and S3 data analyses,published;conferencepaper;hep;core;citeable;arxiv,Class.Quant.Grav.,,,,,,CLASSICAL AND QUANTUM GRAVITY,3723,21,LIGO Scientific,LIGO,Gravitation and Cosmology,2005,0,0,0,0,0,0,0,0,0,0,0,0,0,0,2,3,3,1,0,1,1,0,2,1,1,0,3,1,0,0
